AuthorID,Author,Date,Content,Attachments,Reactions
"322214227978878976","Ria#9814","30-Oct-18 10:35 PM","Thanks, adding i fixed the first error. Now it's saying 
```~/workspace/ $ make int
clang -fsanitize=signed-integer-overflow -fsanitize=undefined -ggdb3 -O0 -std=c11 -Wall -Werror -Wextra -Wno-sign-compare -Wno-unused-parameter -Wno-unused-variable -Wshadow    int.c  -lcrypt -lcs50 -lm -o int
int.c:5:13: error: implicit declaration of function 'get_int' is invalid in C99 [-Werror,-Wimplicit-function-declaration]
    int i = get_int(""Integer: "");
            ^
1 error generated.
make: *** [int] Error 1```

UPDATE: FIXED. was missing #include <cs50.h>","",""
"409535907788750859","MuyCool#4825","31-Oct-18 03:55 AM","@Barry B. Benson make sure your in the right directory","",""
"409535907788750859","MuyCool#4825","31-Oct-18 03:55 AM","Where vegenere file is","",""
"280835681545093120","Barry B. Benson#7037","31-Oct-18 06:38 AM","thanks, fixed it all ready","",""
"399021249667399722","harbar20#9389","01-Nov-18 12:37 AM","how do i move the terminal to the right of the screen?","",""
"399021249667399722","harbar20#9389","01-Nov-18 12:37 AM","i want to see all my code","",""
"393854278764068875","curiouskiwi#1671","01-Nov-18 12:41 AM","close the bottom one and open a new one in a tab on the top","",""
"399021249667399722","harbar20#9389","01-Nov-18 12:42 AM","ok","",""
"399021249667399722","harbar20#9389","01-Nov-18 12:43 AM","thank you!","",""
"443519814019842078","Don Quixote#1855","02-Nov-18 03:01 AM","What am i doing wrong here?","https://cdn.discordapp.com/attachments/395684800830373888/507720892374056981/20181101_193034.jpg",""
"393854278764068875","curiouskiwi#1671","02-Nov-18 03:06 AM","your hello.c is saved in ~/workspace","",""
"393854278764068875","curiouskiwi#1671","02-Nov-18 03:06 AM","did you mean to put it in the pset1 folder?","",""
"393854278764068875","curiouskiwi#1671","02-Nov-18 03:06 AM","you can drag/drop it there in the tree on the left.","",""
"443519814019842078","Don Quixote#1855","02-Nov-18 03:07 AM","Oof. Thank you.","",""
"443519814019842078","Don Quixote#1855","02-Nov-18 03:10 AM","Yep now it works fine. :GWfroggyFacepalm: 
Thanks again!!","",""
"432952780903284737","von Ang#4889","02-Nov-18 05:53 PM","To rename them all?","",""
"432952780903284737","von Ang#4889","02-Nov-18 05:54 PM","all occurrences I mean","",""
"432952780903284737","von Ang#4889","02-Nov-18 05:55 PM","no idea, sorry","",""
"501037430762110986","id#5661","02-Nov-18 06:39 PM","you could open it in vim and use string substitution if you cant find a way to do it in the gui","",""
"501037430762110986","id#5661","02-Nov-18 07:04 PM","oh ok","",""
"508473474281504778","MissAngi#0359","04-Nov-18 05:03 AM","Hi","",""
"508473474281504778","MissAngi#0359","04-Nov-18 05:06 AM","Someone knows why the cs50.h does not recognize the instructions get_char, get_string, get_float ... my program marks errors because it does not recognize them","",""
"393854278764068875","curiouskiwi#1671","04-Nov-18 06:28 AM","@MissAngi did you compile with `make`?  If not (and why not?) did you add the required `-lcs50` clang argument?","",""
"456226577798135808","Deleted User#0000","05-Nov-18 09:22 AM","","https://cdn.discordapp.com/attachments/395684800830373888/508903954050973697/unknown.png",""
"456226577798135808","Deleted User#0000","05-Nov-18 09:22 AM","can anyone tell me what i did wrong","",""
"147489672329822209","DCAP#7461","05-Nov-18 09:26 AM","your statement following your if needs to be inside parentheses","",""
"147489672329822209","DCAP#7461","05-Nov-18 09:26 AM","it thinks you're only asking
`if (c == 'Y')` and can't make sense of the rest of that line","",""
"456226577798135808","Deleted User#0000","05-Nov-18 09:27 AM","ohhh","",""
"456226577798135808","Deleted User#0000","05-Nov-18 09:27 AM","now i get it","",""
"456226577798135808","Deleted User#0000","05-Nov-18 09:27 AM","@DCAP  thanks a lot ^^","",""
"147489672329822209","DCAP#7461","05-Nov-18 09:28 AM","sure thing fam","",""
"456226577798135808","Deleted User#0000","05-Nov-18 09:29 AM","i was stuck in there from yesterday lol","",""
"456226577798135808","Deleted User#0000","05-Nov-18 12:33 PM","Question. When you set a breakpoint on line 4- int main(void) for the following code, and run debug50 why does it not stop at line 4? It stops at line 11 asking for input. Is it something to do with the order of compiling?","",""
"456226577798135808","Deleted User#0000","05-Nov-18 12:33 PM","#include <stdio.h>
#include <cs50.h>

int main(void)
{
int a;

do
{
    a = get_int(""Int: "");
}
while (a <= 0);

}","",""
"359006063019950081","fufr#1439","05-Nov-18 12:38 PM","did you save and compile again after setting your breakpoint?","",""
"456226577798135808","Deleted User#0000","05-Nov-18 12:40 PM","Yes, have you tried it? Is yours stopping on 4?","",""
"359006063019950081","fufr#1439","05-Nov-18 12:43 PM","yes it stops before prompting me","",""
"359006063019950081","fufr#1439","05-Nov-18 12:43 PM","are you running debug50 ./program_name ?","",""
"456226577798135808","Deleted User#0000","05-Nov-18 12:47 PM","yep.. 🤔","",""
"456226577798135808","Deleted User#0000","05-Nov-18 12:47 PM","placed brake point, recompiled, ran with debug. still stops at 11","",""
"456226577798135808","Deleted User#0000","05-Nov-18 12:49 PM","even tried it on line 7 (int a;) still doesnt work..","",""
"456226577798135808","Deleted User#0000","05-Nov-18 12:56 PM","Here's a gif https://imgur.com/a/Dz372EX","",""
"456226577798135808","Deleted User#0000","05-Nov-18 12:59 PM","This occurred in his lecture 2 video at around 50min at the debug50 section as well, Im just confused why this is the case? It makes sense it would stop at the earliest line (as thats the case with VBA which I am familiar with).","",""
"359006063019950081","fufr#1439","05-Nov-18 01:14 PM","Ah I see what you mean but I think this is expected behaviour","",""
"359006063019950081","fufr#1439","05-Nov-18 01:14 PM","The terminal has not prompted you yet","",""
"359006063019950081","fufr#1439","05-Nov-18 01:14 PM","And it is highlighting the next line that would be executed","",""
"359006063019950081","fufr#1439","05-Nov-18 01:15 PM","And waiting for your instructions","",""
"359006063019950081","fufr#1439","05-Nov-18 01:15 PM","You can tell it to then execute it, skip it etc. Does it make sense ?","",""
"456226577798135808","Deleted User#0000","05-Nov-18 10:02 PM","Im just confused why it doesnt stop at the breakpoint. In VBA if I place a breakpoint at the beginning of an Event such as Form_OnClick , when the form is clicked the code will halt at the breakpoint before even stepping into the module. Is that cause VBA isnt compiled at run time whereas this C code is? If I have a breakpoint on line 4 the very beginning of the code, it doesnt make sense why it would run to line 11.","",""
"456226577798135808","Deleted User#0000","05-Nov-18 10:09 PM","My goal is to place it on 4, hit the breakpoint, see the debugger window have no local variables.(since only up til line 4 has been read) Step into til line 7, after line 7 debugger should say local variable a with no value (default is 0 I believe however). Then I should step into until it hits 11 then asks for input in which the debugger value then changes. to said input I want to see all steps of this creation in the debug window.","",""
"456226577798135808","Deleted User#0000","05-Nov-18 11:27 PM","Hundreds of people online but no one can explain basic concept. FeelsBadMan","",""
"393854278764068875","curiouskiwi#1671","05-Nov-18 11:37 PM","seems from the video that it is stopping at the breakpoint.  And then you hit 'play' and it carried on.  Is that not the case?","",""
"359006063019950081","fufr#1439","05-Nov-18 11:39 PM","That’s just how the debugger works as far as I’m aware man I am not sure what else you want us to say here.","",""
"456226577798135808","Deleted User#0000","05-Nov-18 11:41 PM","https://imgur.com/a/jKrYTx5","",""
"456226577798135808","Deleted User#0000","05-Nov-18 11:42 PM","Why in the above gif does the debugger show the local variable. The breakpoint is on 4, the value has not been created. It hasnt even been read. Im so confused","",""
"456226577798135808","Deleted User#0000","05-Nov-18 11:45 PM","Can anyone direct me to a resource who can provide further help?","",""
"359006063019950081","fufr#1439","05-Nov-18 11:49 PM","Maybe I can offer something here actually: what are you trying to accomplish with the debugger here ?","",""
"393854278764068875","curiouskiwi#1671","05-Nov-18 11:50 PM","it shows it because you continued past the breakpoint to line 11 (which is why line 11 is highlighted)","",""
"456226577798135808","Deleted User#0000","05-Nov-18 11:51 PM","what do you mean i continued past the breakpoint?","",""
"456226577798135808","Deleted User#0000","05-Nov-18 11:52 PM","i simply ran debug50, and the highlighted line was on 11. why is line 4 not the highlighted line","",""
"393854278764068875","curiouskiwi#1671","05-Nov-18 11:56 PM","it's how gdb decides when it can break.","",""
"456226577798135808","Deleted User#0000","05-Nov-18 11:57 PM","Can we speak in general. Im  totally on a different page","",""
"393854278764068875","curiouskiwi#1671","05-Nov-18 11:57 PM","When called without any arguments, break sets a breakpoint at the next instruction to be executed in the selected stack frame (see section Examining the Stack). In any selected frame but the innermost, this makes your program stop as soon as control returns to that frame. This is similar to the effect of a finish command in the frame inside the selected frame--except that finish does not leave an active breakpoint. If you use break without an argument in the innermost frame, GDB stops the next time it reaches the current location; this may be useful inside loops. GDB normally ignores breakpoints when it resumes execution, until at least one instruction has been executed. If it did not do this, you would be unable to proceed past a breakpoint without first disabling the breakpoint. This rule applies whether or not the breakpoint already existed when your program stopped.","",""
"393854278764068875","curiouskiwi#1671","05-Nov-18 11:58 PM","it has to do with the frames in the stack","",""
"456226577798135808","Deleted User#0000","05-Nov-18 11:58 PM","forget it. Thanks for the help","",""
"393854278764068875","curiouskiwi#1671","05-Nov-18 11:58 PM","why do you want it to stop at line 4 when nothing will happen?","",""
"393854278764068875","curiouskiwi#1671","05-Nov-18 11:58 PM","there's nothing to see at that point, so it just moves on.","",""
"359006063019950081","fufr#1439","05-Nov-18 11:59 PM","Exactly","",""
"456226577798135808","Deleted User#0000","05-Nov-18 11:59 PM","because i want to see that the local variable window originally contains NOTHING. Then once it hits line 7 it should contain a variable called a. Then once it hits line 11 and asks for a value it will contain that value","",""
"456226577798135808","Deleted User#0000","05-Nov-18 11:59 PM","I want to see the progression in the local window","",""
"393854278764068875","curiouskiwi#1671","05-Nov-18 11:59 PM","so gdb simply doesn't work that way, if you want the simple answer. 😃","",""
"359006063019950081","fufr#1439","05-Nov-18 11:59 PM","Unfortunately that is not how a debugger works.","",""
"393854278764068875","curiouskiwi#1671","05-Nov-18 11:59 PM","here's the documentation for it ftp://ftp.gnu.org/old-gnu/Manuals/gdb/html_node/gdb_28.html#SEC29","",""
"456226577798135808","Deleted User#0000","06-Nov-18 12:00 AM","That is incredibly frustration, illogical and unfortunate. At least to me, but thanks","",""
"456226577798135808","Deleted User#0000","06-Nov-18 12:00 AM","That is how a debugger works in VBA.","",""
"359006063019950081","fufr#1439","06-Nov-18 12:01 AM","I think that when you have the context of a code that is a bit longer, you will see that the breaks that GDB lands actually make sense.","",""
"359006063019950081","fufr#1439","06-Nov-18 12:01 AM","It breaks on “logical steps” of the code and makes it kind of useful to make the code is doing what you want. In my opinion at least.","",""
"456226577798135808","Deleted User#0000","06-Nov-18 12:02 AM","the logical step would be to BREAK where i placed the breakpoint. If i placed the breakpoint on line 4,  it should not go further than line 4 til i tell it to","",""
"456226577798135808","Deleted User#0000","06-Nov-18 12:02 AM","thanks for the help guys","",""
"359006063019950081","fufr#1439","06-Nov-18 12:06 AM","Sure I understand what you mean there. Were you trying to validate something particular in the program ?","",""
"407827414417276938","merkin#5647","06-Nov-18 09:06 AM","hey guys, how do I link the cs50 library to Code Blocks ?","",""
"407827414417276938","merkin#5647","06-Nov-18 09:08 AM","the online IDE doesnt works on my potato machine","",""
"393854278764068875","curiouskiwi#1671","06-Nov-18 09:13 AM","@merkin https://cs50.readthedocs.io/library/c/","",""
"407827414417276938","merkin#5647","06-Nov-18 09:13 AM","done that","",""
"407827414417276938","merkin#5647","06-Nov-18 09:14 AM","but Code Blocks doesnt recognie cs50.h/.a as a lib","",""
"407827414417276938","merkin#5647","06-Nov-18 09:15 AM",".h/.c","",""
"393854278764068875","curiouskiwi#1671","06-Nov-18 09:16 AM","sorry, unfamiliar with code blocks","",""
"393854278764068875","curiouskiwi#1671","06-Nov-18 09:16 AM","can you just use the source code as part of your project?","",""
"393854278764068875","curiouskiwi#1671","06-Nov-18 09:16 AM","https://github.com/cs50/libcs50/tree/develop/src","",""
"407827414417276938","merkin#5647","06-Nov-18 09:41 AM","@curiouskiwi  thank you, ill try it! 😄","",""
"407827414417276938","merkin#5647","06-Nov-18 09:49 AM","ok fyi, i just needed to #include the library exact path","",""
"407827414417276938","merkin#5647","06-Nov-18 09:50 AM","like this^","https://cdn.discordapp.com/attachments/395684800830373888/509273274140590100/library.png",""
"393854278764068875","curiouskiwi#1671","06-Nov-18 09:53 AM","👍","","😘 (1)"
"489527374866808832","jasondd#5057","06-Nov-18 06:49 PM","@KFCManager7#2056 are you actually a KFC manager?","","😄 (1)"
"286196951358373888","codelemur#8004","07-Nov-18 04:15 AM","Has anyone had issues backing up their IDE? I'm hitting https://ide.c9.io/?download=ide50.zip but it's redirecting me to my profile every time 😦","",""
"393854278764068875","curiouskiwi#1671","07-Nov-18 04:36 AM","@codelemur c9 was having problems in the last hour. Perhaps this was a side effect?  I think they're back up.","","🙌 (1)"
"286196951358373888","codelemur#8004","07-Nov-18 05:33 AM","yup that seems to have been it, thanks @curiouskiwi","",""
"300110246238486530","Mr. Distinguished#9941","07-Nov-18 07:58 AM","@curiouskiwi  yes some very strange issues, seems fixed now","",""
"456226577798135808","Deleted User#0000","07-Nov-18 09:26 AM","how do i solve the mario pyramid problem from the problem set 1? it told me to watch the lecture 2 but in that lecture he only talked about how to make the square with #","",""
"456226577798135808","Deleted User#0000","07-Nov-18 09:26 AM","i have no clue how to even start solving it","",""
"456226577798135808","Deleted User#0000","07-Nov-18 09:26 AM","can anyone help","",""
"432952780903284737","von Ang#4889","07-Nov-18 09:46 AM","@Deleted User you'll surely get more help in the #mario  channel. In general you have to think about loops. Have you watched the walkthrough https://youtu.be/EGWRG5e1O2s?","",""
"456226577798135808","Deleted User#0000","07-Nov-18 11:15 AM","oh","",""
"456226577798135808","Deleted User#0000","07-Nov-18 11:16 AM","no i haven't watched the walkthrough yet","",""
"456226577798135808","Deleted User#0000","07-Nov-18 11:16 AM","but thanks @von Ang","",""
"399913366593994762","stuart_clark#0463","08-Nov-18 04:20 PM","I am getting error while running update50 on cs50ide","",""
"399913366593994762","stuart_clark#0463","08-Nov-18 04:22 PM","Fetched 37.3 MB in 12s (2927 kB/s)                                             
W: Failed to fetch http://linux.dropbox.com/ubuntu/dists/precise/main/binary-amd64/Packages  404  Not Found [IP: 143.204.214.125 80]

W: Failed to fetch http://linux.dropbox.com/ubuntu/dists/precise/main/binary-i386/Packages  404  Not Found [IP: 143.204.214.125 80]

E: Some index files failed to download. They have been ignored, or old ones used instead.
Unable to update workspace. Try again in a few minutes!","",""
"399913366593994762","stuart_clark#0463","08-Nov-18 04:25 PM","@curiouskiwi I am getting error while running update50 on cs50ide
Fetched 37.3 MB in 12s (2927 kB/s)
W: Failed to fetch http://linux.dropbox.com/ubuntu/dists/precise/main/binary-amd64/Packages  404  Not Found [IP: 143.204.214.125 80]

W: Failed to fetch http://linux.dropbox.com/ubuntu/dists/precise/main/binary-i386/Packages  404  Not Found [IP: 143.204.214.125 80]

E: Some index files failed to download. They have been ignored, or old ones used instead.
Unable to update workspace. Try again in a few minutes!","",""
"399913366593994762","stuart_clark#0463","08-Nov-18 06:33 PM","@charliekb  tried but same result","",""
"443519814019842078","Don Quixote#1855","08-Nov-18 07:29 PM","Anyone else's IDE acting funny? I was messing with my code and felt like my changes for some reason weren't making the change in the output that they should have. So i cut all of the code from my IDE and saved the program blank. Then re-ran my program and it was still running like there was code there.","",""
"443519814019842078","Don Quixote#1855","08-Nov-18 07:30 PM","I am kinda at a stand still and can't work on my code until IDE is actually registering changes i make. Just wondering if anyone has a fix?","",""
"188847683841032194","Midge#3751","08-Nov-18 08:29 PM","Are you saving them and then compiling them again","",""
"188847683841032194","Midge#3751","08-Nov-18 08:30 PM","Sounds like you're forgetting the compiling part","",""
"443519814019842078","Don Quixote#1855","08-Nov-18 08:49 PM","Ahh.. oops. Thanks lol","",""
"188847683841032194","Midge#3751","08-Nov-18 09:28 PM","No prob","",""
"481139530448109578","angry_pup#9514","09-Nov-18 12:54 AM","Anyone else have no luck logging in to the ide?","",""
"443519814019842078","Don Quixote#1855","09-Nov-18 12:58 AM","@angry_pup
What happens when you try to log in?","",""
"481139530448109578","angry_pup#9514","09-Nov-18 12:59 AM","The “waking up from hibernation” status bar doesn’t move past about 95%. Been there for a good ten minutes. Reloaded the page once, same results.","",""
"443519814019842078","Don Quixote#1855","09-Nov-18 01:05 AM","Try logging in from a different device to see if that works","",""
"443519814019842078","Don Quixote#1855","09-Nov-18 01:05 AM","You can log in on mobile if you have a smart phone","",""
"481139530448109578","angry_pup#9514","09-Nov-18 01:05 AM","Finally logged in. Took 20 minutes.","",""
"443519814019842078","Don Quixote#1855","09-Nov-18 01:05 AM","Oh dang","",""
"481139530448109578","angry_pup#9514","09-Nov-18 01:06 AM","Yep. Oh well.","",""
"470924319128551425","vldfnky#6931","18-Nov-18 07:59 AM","hi, everyone, I have a problem with phpliteadmin - cannot open .db files. see screenshot with the error message. any ideas?","https://cdn.discordapp.com/attachments/395684800830373888/513593971956645889/unknown.png",""
"470924319128551425","vldfnky#6931","18-Nov-18 08:13 AM","i think this is due to the php update i did manually. any idea how to revert it? or how to make a fresh install of the ide?","",""
"432952780903284737","von Ang#4889","18-Nov-18 11:56 AM","Update50","",""
"432952780903284737","von Ang#4889","18-Nov-18 11:57 AM","If you installed anything on top you can run `sudo pip uninstall <packagename>`","",""
"470924319128551425","vldfnky#6931","18-Nov-18 05:33 PM","I think there were few packages and also PHP upgrade. Not sure if I can trace it all back. Any possibility just to get a fresh installation of the IDE?","",""
"393854278764068875","curiouskiwi#1671","18-Nov-18 08:46 PM","@vldfnky you can follow the instructions here: https://cs50.readthedocs.io/ide/faqs/#my-workspace-doesn-t-look-like-david-s-from-lecture-and-none-of-the-50-commands-work-what-should-i-do","",""
"112625916781277184","yama#2710","20-Nov-18 12:57 AM","hm cs50 lab online IDE isn't loading as of today","",""
"112625916781277184","yama#2710","20-Nov-18 01:01 AM","if someone could help me figure out why the cs50 library isn't working locally that would be neat","",""
"298928903437942784","namakadurer#3540","20-Nov-18 05:57 AM","Why would I get a message like this?:  ~/workspace/pset1/ $ ls
greedy*  greedy.c  hello/  hello.c  mario*  mario.c  water*  water.c
~/workspace/pset1/ $ cd pset1/hello/
bash: cd: pset1/hello/: No such file or directory","",""
"393854278764068875","curiouskiwi#1671","20-Nov-18 06:17 AM","```~/workspace/pset1/ $ ls
greedy*  greedy.c  hello/  hello.c  mario*  mario.c  water*  water.c
~/workspace/pset1/ $ cd pset1/hello/
bash: cd: pset1/hello/: No such file or directory```   you are already in the `pset1` directory, so to move into the `hello` directory, you need to simply say `cd hello`","",""
"298928903437942784","namakadurer#3540","20-Nov-18 06:18 AM","oh okay","",""
"393854278764068875","curiouskiwi#1671","20-Nov-18 06:18 AM","or `cd ~/workspace/pset1/hello`","",""
"112625916781277184","yama#2710","20-Nov-18 02:50 PM","well i've followed all the steps in the troubleshooting for libcs50 and still not working, and the web IDE just won't load. Not sure how to carry on with the course :/","",""
"112625916781277184","yama#2710","20-Nov-18 05:48 PM","alright i got help in #archlinux of all places","",""
"371307366937001986","Kaunta#1271","22-Nov-18 11:17 PM","arch is the greatest just wanna let you know","",""
"188847683841032194","Midge#3751","23-Nov-18 06:31 PM","nice meme","",""
"147489672329822209","DCAP#7461","24-Nov-18 09:36 AM","I'm a gentoo man myself","",""
"298928903437942784","namakadurer#3540","26-Nov-18 07:19 PM","I keep  getting this error: ~/workspace/ $ check50 cs50/2018/x/mario/less
Connecting.......
You seem to be missing these files:
 mario.c
Ensure you have the required files before submitting.","",""
"298928903437942784","namakadurer#3540","26-Nov-18 07:19 PM","when I do have it","",""
"298928903437942784","namakadurer#3540","26-Nov-18 07:20 PM","oh it's probably because I refreshed the browser and no longer am in the right directory 😅","",""
"472495048773074974","ritesh#0522","27-Nov-18 05:53 AM","In IDE right-click + copy is not working, though cmnd+c is working","",""
"514924085633875968","Rask Wanscher#3145","27-Nov-18 05:17 PM","The IDE is down for me. Anyone experiencing the same thing?","",""
"284839561543286785","khamul#0109","27-Nov-18 05:28 PM","same, cant access","",""
"514924085633875968","Rask Wanscher#3145","27-Nov-18 05:31 PM","Well, that sucks","",""
"512616173972488205","MaungShine#6469","27-Nov-18 06:28 PM","Same to me","",""
"284839561543286785","khamul#0109","27-Nov-18 06:51 PM","works again : )","",""
"436552620463882251","Jaabe#8350","27-Nov-18 08:12 PM","doesn't seem to work right now","",""
"514924085633875968","Rask Wanscher#3145","27-Nov-18 08:13 PM","Doesn't work for me either","",""
"284839561543286785","khamul#0109","27-Nov-18 08:16 PM","uh, for me it works, but when i opened new tab and tried to open once again it doesnt 😦","",""
"514924085633875968","Rask Wanscher#3145","27-Nov-18 08:18 PM","Seems a bit unstable","",""
"517037483016323083","PvtWitt#9342","27-Nov-18 09:04 PM","IDE has not been working for me all afternoon, still not working atm","",""
"397605574990233601","Ahmad.#8726","27-Nov-18 09:10 PM","Yeah, IDE is down for me as well","",""
"393854278764068875","curiouskiwi#1671","27-Nov-18 09:36 PM","https://cs50.statuspage.io/","",""
"397605574990233601","Ahmad.#8726","27-Nov-18 09:50 PM","Thank you 😃","",""
"517482181661294601","evanm#4777","29-Nov-18 01:43 AM","I just ran update50 and now syntax highlighting doesn't work on any of my existing files or new ones I create, and in night mode the editor background stays white. Any ideas about what's going on or how to fix it would be appreciated. UPDATE - the problem has been resolved for me, editor is working fine again.","",""
"286196951358373888","codelemur#8004","30-Nov-18 04:20 PM","I've tried to kill the debugger but it hanged, and now I'm trying to run again and keep getting this. Does anyone know how to kill the debugger from shell?","https://cdn.discordapp.com/attachments/395684800830373888/518068762046627851/unknown.png",""
"397677328660037632","Maarten#1004","30-Nov-18 08:56 PM","I think they're using Ubuntu (not logged in right now), you can probably make it work with: https://askubuntu.com/questions/104903/how-do-i-kill-processes-in-ubuntu","",""
"397677328660037632","Maarten#1004","30-Nov-18 08:56 PM","You could also just try and restart your workspace","",""
"276841927037419521","H311 YE4H#7766","03-Dec-18 11:53 PM","Hi everyone. I am one small element of functionality away from completing my final project. I wanted to get socket i/o to work and installed it on my ide. Big mistake. Now nothing will run. Is there any way to uninstall or reset it?","",""
"276841927037419521","H311 YE4H#7766","03-Dec-18 11:53 PM","The error I get is:","",""
"276841927037419521","H311 YE4H#7766","03-Dec-18 11:54 PM","","https://cdn.discordapp.com/attachments/395684800830373888/519270145906966539/Screen_Shot_2018-12-03_at_21.53.55.png",""
"347467029051080705","Tubacorn#7109","04-Dec-18 02:03 AM","hey all, does anyone know what this error means? No matter what code I try to compile it always says this","https://cdn.discordapp.com/attachments/395684800830373888/519302735590588416/Screen_Shot_2018-12-03_at_4.01.59_PM.png",""
