AuthorID,Author,Date,Content,Attachments,Reactions
"315162191781298176","ChTBoner#4038","01-Jul-18 01:15 PM","Hello world! Thanks for creating this chan","",""
"315162191781298176","ChTBoner#4038","01-Jul-18 01:17 PM","it seems an update on love2d broke the distributed code","",""
"315162191781298176","ChTBoner#4038","01-Jul-18 01:18 PM","when I run the examples I get an error","",""
"315162191781298176","ChTBoner#4038","01-Jul-18 01:18 PM","https://www.reddit.com/r/love2d/comments/8eb6z4/weird_error_using_pushlua/","",""
"315162191781298176","ChTBoner#4038","01-Jul-18 01:19 PM","https://love2d.org/wiki/love.window.getPixelScale","",""
"315162191781298176","ChTBoner#4038","01-Jul-18 01:20 PM","the getPixelScale function is deprecated","",""
"393854278764068875","curiouskiwi#1671","01-Jul-18 02:00 PM","@ChTBoner you'll need to use version 0.10.2 which is linked from the main edX course page (in the right sidebar here: https://courses.edx.org/courses/course-v1:HarvardX+CS50G+Games/course/)  We'll make that clearer in the first spec.","",""
"315162191781298176","ChTBoner#4038","01-Jul-18 02:11 PM","ok thanks for the reply","",""
"315162191781298176","ChTBoner#4038","01-Jul-18 02:11 PM","didn't use the link to install but directly from love2d's homepage","",""
"374985536903053313","hadi#5135","01-Jul-18 03:21 PM","yup the documentation reads: ""This function has been renamed to love.window.getDPIScale.""
I replaced getPixelScale() with getDPIScale() error is gone but now getting a white screen.","",""
"223495044571725825","Gramby#7225","01-Jul-18 08:55 PM","@hadi I had the same issue, but after downgrading to version 0.10.2 everything is working properly","",""
"162677003047272448","Zesty#7788","02-Jul-18 05:41 PM","Can this course be taken without taking CS50 first, or is this a continuation of cs50","",""
"211790818304851968","Faust#1079","02-Jul-18 05:56 PM","@Zesty Do you know basic programming?","",""
"211790818304851968","Faust#1079","02-Jul-18 05:56 PM","Or I guess python to be more specific","",""
"162677003047272448","Zesty#7788","02-Jul-18 06:00 PM","I'm familiar with pytohn, yes","",""
"162677003047272448","Zesty#7788","02-Jul-18 06:00 PM","took a class last semester","",""
"162677003047272448","Zesty#7788","02-Jul-18 06:01 PM","I understand basic programming concepts","",""
"162677003047272448","Zesty#7788","02-Jul-18 06:04 PM","I'm taking cs50 rn so I can stick with one instructional method to learn programming, because I've been jumping around from project to project, not learning too much in any one area","",""
"211790818304851968","Faust#1079","02-Jul-18 06:27 PM","It's probably best to finish up with cs50 first then","",""
"211790818304851968","Faust#1079","02-Jul-18 06:27 PM","you could probably do without it if you really wnated tho","",""
"456226577798135808","Deleted User#0000","02-Jul-18 06:52 PM","guys","",""
"456226577798135808","Deleted User#0000","02-Jul-18 06:52 PM","so i download the pong project","",""
"456226577798135808","Deleted User#0000","02-Jul-18 06:52 PM","and when i run the main.lua file using LOVE","",""
"456226577798135808","Deleted User#0000","02-Jul-18 06:52 PM","all i get is a completely white screen and an FPScounter on the top left","",""
"456226577798135808","Deleted User#0000","02-Jul-18 06:58 PM","nvm i fixed it","",""
"456226577798135808","Deleted User#0000","02-Jul-18 06:58 PM","was using the newest version of LOVE","",""
"456226577798135808","Deleted User#0000","02-Jul-18 06:58 PM","so i installed version 0.12.2 and it worked","",""
"354536811500142592","bluebooger#8988","02-Jul-18 07:03 PM","@Deleted User  hope you mena version LÃ–VE 0.10.2   https://bitbucket.org/rude/love/downloads/","",""
"456226577798135808","Deleted User#0000","02-Jul-18 07:04 PM","oh yeah my bad","",""
"456226577798135808","Deleted User#0000","02-Jul-18 07:04 PM","meant 0.10.2","",""
"162677003047272448","Zesty#7788","02-Jul-18 07:11 PM","does cs50 game dev go through general programming bits too?","",""
"354536811500142592","bluebooger#8988","02-Jul-18 07:23 PM","@Zesty  no -- it assumes a basic understanding of variables, loops, booleans, functions and other things taught in a basic programming course -- it assuems no knolwedge of game programming or of Lua or of Love2d -- you could try the game dev course without previous knowledge, but you'll probably get lost","",""
"162677003047272448","Zesty#7788","02-Jul-18 07:25 PM","I took a course in python that went over variables, loops, bools, functions, methods, and classes","",""
"354536811500142592","bluebooger#8988","02-Jul-18 07:27 PM","@Zesty then you should have no problem","",""
"162677003047272448","Zesty#7788","02-Jul-18 07:32 PM","alright, thanks for the clarification","",""
"463383344470687745","Mars#3720","02-Jul-18 08:04 PM","I havent finished cs50 but I'm taking cs50-web and cs50-mobile. Honestly, if you're familiar with programming then you should be good @Zesty","",""
"463383344470687745","Mars#3720","02-Jul-18 08:06 PM","But, I'm in my senior year of college and already took System programming in C and did Advanced Data Structures in C++","",""
"162677003047272448","Zesty#7788","02-Jul-18 08:08 PM","I'll give it a shot and see how it plays out","",""
"88662800808820736","Chronix#9702","02-Jul-18 09:57 PM","Hi all, going through the first lecture atm and every time I try and run pong-1 I get this error. Could someone point me to what the problem is or should I just keep following through the lecture until the end and not worry about this for now?

Error

push.lua:101: attempt to call field 'getPixelScale' (a nil value)


Traceback

push.lua:101: in function 'initValues'
push.lua:48: in function 'setupScreen'
main.lua:47: in function 'load'
[C]: in function 'xpcall'
[C]: in function 'xpcall'","",""
"463383344470687745","Mars#3720","02-Jul-18 09:59 PM","@Chronix  check your version of Lua","",""
"88662800808820736","Chronix#9702","02-Jul-18 09:59 PM","Oh, that's probably where I'm going wrong haha, didn't realise I had to install lua, I just thought it was compiled. Good start to the course ðŸ˜„","",""
"463383344470687745","Mars#3720","02-Jul-18 09:59 PM","* L.O.V.E","",""
"88662800808820736","Chronix#9702","02-Jul-18 10:05 PM","Trying to find some information online about lua. Do I just need to install Love2d and that's all or do I need to install something else along side it?","",""
"88662800808820736","Chronix#9702","02-Jul-18 10:05 PM","Btw, my Love2d version is 11.1","",""
"354536811500142592","bluebooger#8988","02-Jul-18 10:11 PM","@Chronix  https://www.reddit.com/r/cs50/comments/8rsvya/now_on_edx_cs50s_introduction_to_game_development/","",""
"88662800808820736","Chronix#9702","02-Jul-18 10:16 PM","Awesome, thanks @bluebooger. Installed the version mentioned in the course and everything works. Much appreciated!","",""
"463383344470687745","Mars#3720","02-Jul-18 10:17 PM","@bluebooger your're taking the game one too?","",""
"112625916781277184","yama#2710","02-Jul-18 10:43 PM","hey guys, i'm watching the first lecture","",""
"112625916781277184","yama#2710","02-Jul-18 10:43 PM","anyone here happen to be on arch linux?","",""
"354536811500142592","bluebooger#8988","02-Jul-18 11:05 PM","@Mars planning on it -- don't know if I'll have the discipline to complete it -- I started watching the videos when it has taught online at Harvard Extension school in the spring - just lacked the discipline to watch them all","",""
"463443143728300042","phil#7077","02-Jul-18 11:44 PM","Having problem running the pong examples and the assignment i get error in 'getPixcelScale' Love v1.1 Lua V5.3.1 love does work with simple hello world program","",""
"393854278764068875","curiouskiwi#1671","02-Jul-18 11:45 PM","@phil check your Love version. You need to be using v 0.10.2 as linked on the edx course page","",""
"463443143728300042","phil#7077","02-Jul-18 11:49 PM","Thanks I must have missed that was thinking it was a version conflict.","",""
"88662800808820736","Chronix#9702","03-Jul-18 12:00 AM","So I've just watched the video and finished the first assignment, how do I submit it? The How to Submit section says Coming Soon. Shall I just wait until that's available?","",""
"393854278764068875","curiouskiwi#1671","03-Jul-18 12:02 AM","Yes, you'll have to wait. ðŸ˜ƒ","",""
"88662800808820736","Chronix#9702","03-Jul-18 12:02 AM","Ok no problem, am I good to continue with the course?","",""
"393854278764068875","curiouskiwi#1671","03-Jul-18 12:02 AM","yes","",""
"88662800808820736","Chronix#9702","03-Jul-18 12:02 AM","Awesome, cheers ðŸ˜ƒ","",""
"463443143728300042","phil#7077","03-Jul-18 12:11 AM","installed  0.10.2 now its broken love does not start liblove.so.0 cannot open shared object!!","",""
"463443143728300042","phil#7077","03-Jul-18 12:42 AM","Ok i got it sorted I had not downgraded liblove to 0.10.2 Thanks again for pointing me in the right direction.","",""
"258779073998880769","DishWasher#8306","03-Jul-18 03:50 AM","Hello folks, does anybody know if the GS50 lectures are available on the CS50 Roku app?","",""
"463411225192300574","PopsMaellard#7554","04-Jul-18 06:52 PM","Hey guys, has anyone finished the flappy bird assignment? Any ideas on the last point would be greatly appreciated. I've set it to enter a PauseState, and that part works fine. The problem is, when I go back to PlayState using 
gStateMachine:change('play')
the game restarts completely.","",""
"316406460701605899","WilkyMay#7463","04-Jul-18 07:44 PM","@PopsMaellard i made a pause state using a boolean instead of using the state machine, so it keeps rendering the game on the background but without updating the positions. but you could make the game restart when exiting the ScoreState instead of doing it when initializing the PlayState","",""
"462884397369131008","zain442#4028","04-Jul-18 10:41 PM","hi clan, so i have successfully created an AI for my pong game. Only thing is my Ai paddle keeps flickering up and down. However I can mange to play against it. I'm unsure  of what i'm doing wrong. Any clues anyone? thank you","",""
"316406460701605899","WilkyMay#7463","04-Jul-18 10:50 PM","@zain442 hard to tell without seeing your code nor knowing your logic","",""
"462884397369131008","zain442#4028","04-Jul-18 10:57 PM","i'm unsure if i'm allowed to put up my code, but my logic is around if player1.dy is <> than ball.y then move player1.y by paddle_speed. does that help.","",""
"316406460701605899","WilkyMay#7463","04-Jul-18 10:59 PM","you mean if player.y <> ball, right?","",""
"316406460701605899","WilkyMay#7463","04-Jul-18 11:03 PM","@zain442 i would say that when you move the paddle up it goes beyond the ball position, then in the next frame it goes down, again beyond the ball position","",""
"316406460701605899","WilkyMay#7463","04-Jul-18 11:04 PM","then it repeats, creating flickering","",""
"463411225192300574","PopsMaellard#7554","04-Jul-18 11:07 PM","@WilkyMay  Thanks Cage, yeah using a  boolean did make life easier","",""
"316406460701605899","WilkyMay#7463","04-Jul-18 11:07 PM","ðŸ˜‰","",""
"462884397369131008","zain442#4028","04-Jul-18 11:09 PM","@WilkyMay  thanks, yeah that's my thinking.","",""
"316406460701605899","WilkyMay#7463","04-Jul-18 11:10 PM","super glad to help =)","",""
"225681222032949258","Ned#7585","06-Jul-18 04:50 AM","zain442, I had the same problem at first, then I changed it so dy could vary continuously from 0 to PADDLE_SPEED.  So if the ball was at the same y as the paddle, I set dy to 0.  I proportionally increased dy until the ball was at the top or bottom of the paddle, where I set it to PADDLE_SPEED.    If the ball was outside the paddle, then I just set it to PADDLE_SPEED (appropriate sign, of course).  If you wanted to make it seem more like a real person was pushing buttons, allowing dy to be only +-PADDLE_SPEED (or 0), then  you could try using some hysteresis.  E.g., if the paddle was going up or stationary, then you wouldn't make it go down until the ball was further down the paddle (near the bottom instead of the center).   You could even estimate where the ball would hit the paddle if properly placed and move it full speed to precisely that location, ignoring the current y location.","",""
"88662800808820736","Chronix#9702","06-Jul-18 12:48 PM","`if (ball.y < player2.y)
{
  player2.dy = -PADDLE_SPEED;
} else if (ball.y > player2.y + player2.height)
{ 
  player2.dy = PADDLE_SPEED;
} else
{
  player2.dy = 0;
}`","",""
"88662800808820736","Chronix#9702","06-Jul-18 12:50 PM","Something similar to this would make it stop jumping up and down as you're only moving the paddle if it's above or below the paddle. Originally I had it shaking because I was testing each time to see if the middle of the paddle was greater or less than `paddle.y + (paddle.height / 2)`","",""
"462884397369131008","zain442#4028","06-Jul-18 01:39 PM","@Ned and @Chronix  thanks for your help. I've got it working  now and I understand where my mistake was. thanks .","",""
"88662800808820736","Chronix#9702","06-Jul-18 01:39 PM","No problem","",""
"225681222032949258","Ned#7585","06-Jul-18 08:49 PM","It might even be interesting to limit how fast the paddle movement can change, much like with a real player.","",""
"462884397369131008","zain442#4028","06-Jul-18 10:05 PM","true Ned, i've also made it so that the AI paddle doesn't move if the ball is in the last 2/5 of the screen. Makes it look more human.","",""
"333842064150102026","LicensedToThrill#1059","07-Jul-18 03:25 AM","Hi guys, I've taken a few game dev classes and am pretty comfortable with this stuff at this point, but decided to take GD50 for fun. I noticed that the prof. briefly mentions Delta Time in the very first Lecture (Pong 0) and I wanted to write a very brief, uber-simple explanation of why Delta Time is important for those who are anxious and curious to learn and don't want to wait until later lessons. However, I'm struggling to find the appropriate way to do this because so many toxic... err... I mean helpful forums like Reddit get unreasonably angry when two people post the same thing twice. (Pretty psycho reaction to something so unharmful). So is there a place where I create a helpful explanation for those eager to learn that is A. sure to be seen first / searched first and B. won't land me in a Russian gulag for repeating information in a more beginner-friendly way like a decent human being?","",""
"333842064150102026","LicensedToThrill#1059","07-Jul-18 03:25 AM","Sincerely, dude trying to help, getting lit on fire for it.","",""
"463443143728300042","phil#7077","07-Jul-18 01:09 PM","trying  to use the flappy code to make a simply demo for me to learn to use sate machines but i am getting a error saying  ""attempt to call a method exit a nil value, can someone point me in the right direction to start looking please ??","",""
"316406460701605899","WilkyMay#7463","07-Jul-18 06:55 PM","@phil you're trying to call a exit function that doesn't exist, make sure your state includes the base state using <state name> = Class {__includes = BaseState} at the begining (there are two underlines before 'includes')","",""
"463443143728300042","phil#7077","08-Jul-18 12:15 AM","Thanks cage after much searching i spotted it, its hard to spot your simple errors when you are learning new languages and structures. it was as you said the 'exit' function was missing.","",""
"316406460701605899","WilkyMay#7463","08-Jul-18 12:24 AM","i agree, my first time using lua too","",""
"218013645580402689","Hexer#3391","08-Jul-18 08:49 PM","Hey everyone, at which problem set or game will Unity be used?","",""
"316406460701605899","WilkyMay#7463","08-Jul-18 08:59 PM","@Hexer  looks like we'll use it in the '3d helicopter game'","",""
"316406460701605899","WilkyMay#7463","08-Jul-18 08:59 PM","for it is the first 3d game on the list","",""
"218013645580402689","Hexer#3391","08-Jul-18 08:59 PM","Really unfortuante that it isn't being used in all games","",""
"316406460701605899","WilkyMay#7463","08-Jul-18 09:01 PM","not really unfortunate, even tho it is used for most indie games sometimes is better to use other simpler engines","",""
"383083650146762754","sharkantropo#3761","08-Jul-18 09:28 PM","Hey. I have certain issue when I attempt to run ""pong-2"" on LOVE2DS. It didn't render anything, just the blank screen window. I already replace deprecated getPixelScale() with getDPScale() by the way.","",""
"383083650146762754","sharkantropo#3761","08-Jul-18 10:19 PM","Nvm I downloaded an older version of the framework","",""
"443422918471581716","super_sonic181#1508","09-Jul-18 03:49 PM","What types of game we are talking about?","",""
"316406460701605899","WilkyMay#7463","09-Jul-18 06:44 PM","@super_sonic181 sorry, i did not understand the question","",""
"443422918471581716","super_sonic181#1508","09-Jul-18 06:51 PM","Channel Name says 'Cs50-games' so by that which games are we talking about ?","",""
"316406460701605899","WilkyMay#7463","09-Jul-18 07:07 PM","'CS50's Introduction to Game Development' course","",""
"112625916781277184","yama#2710","09-Jul-18 09:15 PM","did you guys put the pong AI under a function?","",""
"316406460701605899","WilkyMay#7463","09-Jul-18 09:27 PM","@yama not really, i've just put it instead of the player 2's movement. but you can","",""
"354536811500142592","bluebooger#8988","09-Jul-18 09:43 PM","@super_sonic181  https://www.edx.org/course/cs50s-introduction-to-game-development-0  go there and scroll down to see list of games","",""
"443422918471581716","super_sonic181#1508","09-Jul-18 09:47 PM","@bluebooger Thanks","",""
"181174929901879296","megla#7780","10-Jul-18 04:28 PM","when do the submits become available?","",""
"181174929901879296","megla#7780","10-Jul-18 04:29 PM","and do assignments get checked, even if you haven't paid for the certificate already?","",""
"354536811500142592","bluebooger#8988","10-Jul-18 06:28 PM","@megla from the cs50-mobile channel ""The submission instructions are coming soon (hopefully within the next week)""  
I'm guessign they have the same timeline for the games course too","",""
"381840470814490624","Dale#7314","11-Jul-18 06:32 PM","Hey @everyone, not sure if this has been mention in the chat before. There is no download link for lecture 8: Pokemon.","",""
"381840470814490624","Dale#7314","11-Jul-18 06:32 PM","On the edx website that is","",""
"112625916781277184","yama#2710","12-Jul-18 04:47 AM","the first lecture has pauses for small breaks, but the 2nd doesn't seem to have them, I miss them","",""
"112625916781277184","yama#2710","18-Jul-18 05:20 AM","so i can't figure out how to make the bird stop in position and then resume in the same position when i unpause the game. I can pause and resume the music but the bird starts over from the center when i unpause","",""
"316406460701605899","WilkyMay#7463","18-Jul-18 06:12 AM","if you're trying to make the pause a state then you should give the position as one of the parameters","",""
"467755986996953088","wisse#0635","18-Jul-18 06:41 PM","Hi guys. I really enjoy this course. Have been running through the lectures and assignments last couple of days. Currently at blockout homework","",""
"467755986996953088","wisse#0635","18-Jul-18 06:42 PM","Breakout*","",""
"342595453893869568","czesio#3378","18-Jul-18 06:47 PM","Was it only me having problems wit starting up?
I did get error regarding love.window.getPixelScale()
function that is not supported any more.
So for me examples are not working on love 11.1
pong-0 is working fine 
With pong-1 i get:

Error

push.lua:101: attempt to call field 'getPixelScale' (a nil value)


Traceback

push.lua:101: in function 'initValues'
push.lua:48: in function 'setupScreen'
main.lua:47: in function 'load'
[C]: in function 'xpcall'
[C]: in function 'xpcall'

So i replaced 'getPixelScale' with 'getDPIScale'
because
https://love2d.org/wiki/love.window.getPixelScale
wit pong-2 i get only white screen don't know why...
So I found love archive and downloaded 10.0 considering both course date and getPixelScale function removal in newer versions
is it only me having this much trouble with getting things working?
 
sorry for spelling mistakes this is not my first language 
regards lukasz","",""
"316406460701605899","WilkyMay#7463","18-Jul-18 07:17 PM","i've used 0.11.2 for some with not much trouble, but with the zelda game i quit using it and downloaded the 0.10 instead","",""
"316406460701605899","WilkyMay#7463","18-Jul-18 07:18 PM","so yeah, everybody is having problems with the new versions","",""
"112625916781277184","yama#2710","18-Jul-18 09:21 PM","yeah it's kind of annoying","",""
"112625916781277184","yama#2710","18-Jul-18 09:21 PM","@WilkyMay and yeah that's what I was thinking but I don't know how to pass the position to the Bird fuction","",""
"316406460701605899","WilkyMay#7463","18-Jul-18 09:24 PM","when you're changing back to the play state you set as a parameter, then on the playState:enter you get the parameter and set the bird position","",""
"316406460701605899","WilkyMay#7463","18-Jul-18 09:24 PM","@yama","",""
"316406460701605899","WilkyMay#7463","18-Jul-18 09:26 PM","take a look on how the score is set from the playState to the scoreState for instance","",""
"112625916781277184","yama#2710","18-Jul-18 09:42 PM","that's what I've been attempting, I think the issue i have is not how to pass the params from pause to play state, but how to set the location from within playstate towards Bird. I will keep trying and if I can't figure it out I'll bug you again @WilkyMay","",""
"316406460701605899","WilkyMay#7463","18-Jul-18 09:44 PM","alright, make sure you're using playState:enter and not playState:init, cause init dont receive parameters","",""
"112625916781277184","yama#2710","19-Jul-18 07:30 AM","yeah I'm confused. The issue is passing the params *from* playstate *to* Bird, so i can't use `:enter` because that's a function of the statemachine, and bird is not a state","",""
"316406460701605899","WilkyMay#7463","19-Jul-18 07:38 PM","@yama you need to pass the params to the playState, this state have access to the bird, so you receive it and set it to the bird's Y","",""
"112625916781277184","yama#2710","19-Jul-18 07:39 PM","@WilkyMay i can do the first part, but I don't know how to use playState to set the bird's Y. It could be just my lack of lua knowledge","",""
"112625916781277184","yama#2710","19-Jul-18 07:40 PM","Are there any examples in the code of passing params like that, but not through the state machine?","",""
"316406460701605899","WilkyMay#7463","19-Jul-18 07:43 PM","i dont think there is an example in this project, there is on pong tho","",""
"316406460701605899","WilkyMay#7463","19-Jul-18 07:44 PM","take a look on how we're passing the delta y to the paddles on pong","",""
"112625916781277184","yama#2710","19-Jul-18 07:51 PM","hmmm I didn't think to look at pong, ty","",""
"316406460701605899","WilkyMay#7463","19-Jul-18 07:53 PM","glad to help ^^","",""
"112625916781277184","yama#2710","20-Jul-18 12:22 AM","oh and btw, i absolutely loathe the music from fifty bird by now","",""
"316406460701605899","WilkyMay#7463","20-Jul-18 01:11 AM","ikr =P","",""
"112625916781277184","yama#2710","20-Jul-18 01:16 AM","I figured it out ðŸ˜ƒ thanks again @WilkyMay","",""
"316406460701605899","WilkyMay#7463","20-Jul-18 01:16 AM","ðŸ˜‰","",""
"466969222203834368","CBnimble#7287","20-Jul-18 07:06 PM","@yama I'd be curious as to seeing your solution. I just handled my pause from main but also went down the changestate path. It just seemed as if this code wasn't really designed for it! I could be wrong though as I'm a newbie programmer and this is my first dive into game code/design. Cheers","",""
"112625916781277184","yama#2710","20-Jul-18 07:08 PM","@CBnimble i'm a newb too, i know some python mostly but that's it. I wish I had used git for commit messages to make the changes I made more clear, but I didn't (I probably will for the next assignment) so I can share my final code so you can take a look at it. If you find anything wrong with it let me know too. Give me a sec and i'll upload it","",""
"112625916781277184","yama#2710","20-Jul-18 07:12 PM","@CBnimble can you open a .tar file?","",""
"466969222203834368","CBnimble#7287","20-Jul-18 07:13 PM","I'm not sure too sure tbh","",""
"112625916781277184","yama#2710","20-Jul-18 07:14 PM","https://paste.xinu.at/hN4/ ok i made it a zip file","",""
"112625916781277184","yama#2710","20-Jul-18 07:15 PM","warning: don't make fun of my shitty medals ðŸ˜„ second warning, I didn't implement all three medals fully","",""
"466969222203834368","CBnimble#7287","20-Jul-18 07:15 PM","ha no worries, I'm not on the medals yet either!","",""
"466969222203834368","CBnimble#7287","20-Jul-18 07:16 PM","thank you","",""
"466969222203834368","CBnimble#7287","20-Jul-18 07:17 PM","folder was empty ðŸ˜¦","",""
"112625916781277184","yama#2710","20-Jul-18 07:18 PM","huh, I tested it and it works fine for me. I'll upload somewhere else","",""
"112625916781277184","yama#2710","20-Jul-18 07:19 PM","oh you're right it's empty","",""
"112625916781277184","yama#2710","20-Jul-18 07:21 PM","https://paste.xinu.at/SwR/ this should work (it's gonna decompress in the folder you extract it so make a new folder for it)","",""
"466969222203834368","CBnimble#7287","20-Jul-18 09:05 PM","@yama So odd that the files from the states folder have gone missing too!","",""
"466969222203834368","CBnimble#7287","20-Jul-18 09:14 PM","side question: any thoughts on why the love.graphics.printf('Paused', 0, 64, VIRTUAL_WIDTH, 'center') would render in the top left of the screen? When I first tried it it was perfectly centered...","",""
"112625916781277184","yama#2710","20-Jul-18 09:17 PM","https://paste.xinu.at/vPRX/ gah, i never zip stuff sorry","",""
