AuthorID,Author,Date,Content,Attachments,Reactions
"181511246707818496","IkeKap#8206","17-Apr-20 11:47 PM","","https://cdn.discordapp.com/attachments/462922474733174784/700809706637099158/unknown.png",""
"424665581887684609","ColdSnipez#8429","17-Apr-20 11:47 PM","Yeah and everytime I execute the command I get the error at the bottom right","https://cdn.discordapp.com/attachments/462922474733174784/700809740745310299/image0.jpg",""
"545823135732334592","spicymeatballa#3726","17-Apr-20 11:47 PM","@Elextro1 i changed the 255 to 0 (for the 4th parameter) and it worked","",""
"181511246707818496","IkeKap#8206","17-Apr-20 11:49 PM","@ColdSnipez did that help?","",""
"181511246707818496","IkeKap#8206","17-Apr-20 11:49 PM","also is ! the syntax for negating a boolean in lua/love?","",""
"311614789908692994","QWERTYiOP56#6902","17-Apr-20 11:50 PM","i think its ~","",""
"424665581887684609","ColdSnipez#8429","17-Apr-20 11:50 PM","The only way I can run it is if I take the folder that contains that main.lua file and drag it to the Love2D application.","",""
"424665581887684609","ColdSnipez#8429","17-Apr-20 11:50 PM","But I canâ€™t run it on VS code for some reason","",""
"181511246707818496","IkeKap#8206","17-Apr-20 11:50 PM","@ColdSnipez that sounds like your global install of love2d might be borked. Try reinstalling + restart","",""
"424665581887684609","ColdSnipez#8429","17-Apr-20 11:50 PM","Bet, will do","",""
"311614789908692994","QWERTYiOP56#6902","17-Apr-20 11:50 PM","cuz i tried:
if x != 0 then
... end

and it corrected me to :
if x ~= 0 then
... end","",""
"181511246707818496","IkeKap#8206","17-Apr-20 11:51 PM","ah kk tnx!","",""
"181511246707818496","IkeKap#8206","17-Apr-20 11:52 PM","what ide are you using btw @QWERTYiOP56","",""
"424665581887684609","ColdSnipez#8429","18-Apr-20 12:02 AM","I did what you recommended but when using cmd + L, I get the same message:
Running the contributed command: 'pixelbyte.love2d.run' failed.","",""
"424665581887684609","ColdSnipez#8429","18-Apr-20 12:02 AM","@IkeKap","",""
"311614789908692994","QWERTYiOP56#6902","18-Apr-20 12:03 AM","vscode on windows 10","",""
"181511246707818496","IkeKap#8206","18-Apr-20 12:03 AM","are you running https://bitbucket.org/rude/love/downloads/love-0.10.2-macosx-x64.zip as your installation of love?","",""
"311614789908692994","QWERTYiOP56#6902","18-Apr-20 12:03 AM","i use it for almost every language (except C#) so i trust it","",""
"311614789908692994","QWERTYiOP56#6902","18-Apr-20 12:04 AM","i just installed it from their website","",""
"181511246707818496","IkeKap#8206","18-Apr-20 12:04 AM","how did you get syntax correction working on vscode? it doesn't look like that extension is checking it rn on my end","",""
"311614789908692994","QWERTYiOP56#6902","18-Apr-20 12:05 AM","for syntax im using the lua plug in","",""
"424665581887684609","ColdSnipez#8429","18-Apr-20 12:05 AM","I was using love 11.3 to be exact","",""
"311614789908692994","QWERTYiOP56#6902","18-Apr-20 12:05 AM","and the love2d support plug in is for the running from editor functionality (and so there isnt a red line under every ""love."")","",""
"311614789908692994","QWERTYiOP56#6902","18-Apr-20 12:06 AM","oh thats another thing","",""
"311614789908692994","QWERTYiOP56#6902","18-Apr-20 12:06 AM","i went with love 10.3 because the push class is broken in love 11.3","",""
"311614789908692994","QWERTYiOP56#6902","18-Apr-20 12:06 AM","at least the provided push class is","",""
"181511246707818496","IkeKap#8206","18-Apr-20 12:07 AM","so what is the difference between love and lua? is love just a game related extension to the language?","",""
"311614789908692994","QWERTYiOP56#6902","18-Apr-20 12:08 AM","love is the game engine","",""
"311614789908692994","QWERTYiOP56#6902","18-Apr-20 12:08 AM","it offers some functions so that it makes creation easier","",""
"311614789908692994","QWERTYiOP56#6902","18-Apr-20 12:08 AM","lua is the language used to interact with the game engine","",""
"424665581887684609","ColdSnipez#8429","18-Apr-20 12:09 AM","So I have deleted the 11.3 version and now I have the 10.2. Is there any other configuration that I would need to do?","",""
"181511246707818496","IkeKap#8206","18-Apr-20 12:09 AM","ah kk tnx so much","",""
"181511246707818496","IkeKap#8206","18-Apr-20 12:10 AM","I would uninstall and reinstall the love plugin from vscode so that it isn't confused on what version you have and where it is","",""
"311614789908692994","QWERTYiOP56#6902","18-Apr-20 12:10 AM","make sure to go to the plug in settings after youre done and define the path for where your love.exe is","",""
"424665581887684609","ColdSnipez#8429","18-Apr-20 12:12 AM","And I would find that in VS Code?","",""
"311614789908692994","QWERTYiOP56#6902","18-Apr-20 12:13 AM","file > preferences > settings > extensions > LOVE2D Config > Path","",""
"311614789908692994","QWERTYiOP56#6902","18-Apr-20 12:14 AM","change that to the directory where you stored the program\LOVE.exe","",""
"181511246707818496","IkeKap#8206","18-Apr-20 12:14 AM","@QWERTYiOP56 how'd you manage to get rid of all the undefined global love errors in VSCode?","",""
"424665581887684609","ColdSnipez#8429","18-Apr-20 12:14 AM","Thanks âœðŸ½","",""
"311614789908692994","QWERTYiOP56#6902","18-Apr-20 12:15 AM","im not entirely sure","",""
"311614789908692994","QWERTYiOP56#6902","18-Apr-20 12:15 AM","I kinda just installed the extension and restarted vscode","",""
"181511246707818496","IkeKap#8206","18-Apr-20 12:15 AM","ah kk tnx","",""
"181511246707818496","IkeKap#8206","18-Apr-20 12:21 AM","I think I managed to crash Love2d for the first time haha","",""
"181511246707818496","IkeKap#8206","18-Apr-20 12:21 AM","tried to solve assignment 0 but now the code refuses to run with no critical errors...","",""
"672471131026096129","omdagoalie#1252","18-Apr-20 12:23 AM","can someone help me with the pong assignment i know where to put the code but need help on how to write it but i know the basic idea","",""
"181511246707818496","IkeKap#8206","18-Apr-20 12:23 AM","ok so the issue is in my code bc it runs fine when I get rid of the function call","",""
"672471131026096129","omdagoalie#1252","18-Apr-20 12:23 AM","do you have the right version?","",""
"672471131026096129","omdagoalie#1252","18-Apr-20 12:24 AM","@IkeKap","",""
"181511246707818496","IkeKap#8206","18-Apr-20 12:24 AM","of love2d? yup. It's just my code that's acting up bc the game without my code runs fine","",""
"311614789908692994","QWERTYiOP56#6902","18-Apr-20 12:28 AM","@omdagoalie make sure you look at the lectures; they're really helpful with teaching the basics of Lua","",""
"424665581887684609","ColdSnipez#8429","18-Apr-20 12:28 AM","So I changed the path but Iâ€™m still getting the same error unfortunately.","",""
"672471131026096129","omdagoalie#1252","18-Apr-20 12:28 AM","okay thank you I will look at it again","",""
"311614789908692994","QWERTYiOP56#6902","18-Apr-20 12:28 AM","the professor is assuming that no one in the class knows how to use Love or Lua so it's pretty beginner-firendly","",""
"311614789908692994","QWERTYiOP56#6902","18-Apr-20 12:29 AM","cold have you tried running the code using cmd?","",""
"311614789908692994","QWERTYiOP56#6902","18-Apr-20 12:30 AM","idk how to do this for mac, but for windows i type this into the console:

""D:\Programs\Love\LOVE.exe"" ""D:\Projects\GD50 Class\ [assignment name]"" --cmd","",""
"311614789908692994","QWERTYiOP56#6902","18-Apr-20 12:30 AM","keep in mind, that's the directory where my .exe and project folder are stored; yours are probably different","",""
"181511246707818496","IkeKap#8206","18-Apr-20 12:31 AM","is there any way to debug love2d code? I tried creating a method to have a computer controlled paddle for pong, but whenever I call it I get this window with no errors","https://cdn.discordapp.com/attachments/462922474733174784/700820839528136856/unknown.png",""
"311614789908692994","QWERTYiOP56#6902","18-Apr-20 12:32 AM","execute it through the command console","",""
"311614789908692994","QWERTYiOP56#6902","18-Apr-20 12:32 AM","with the --cmd argument at the end","",""
"311614789908692994","QWERTYiOP56#6902","18-Apr-20 12:32 AM","that attaches a cmd window to the application and prints and debug statements that you define","",""
"545823135732334592","spicymeatballa#3726","18-Apr-20 12:39 AM","i added the love.exe folder to my path environment variable","",""
"545823135732334592","spicymeatballa#3726","18-Apr-20 12:46 AM","also got around the white screen by changing this line
   love.graphics.clear(40, 45, 52, 255) to
   love.graphics.clear(40, 45, 52, 0)","",""
"379783803390001167","Highly Nonexistent#6057","18-Apr-20 01:37 AM","I have a question regarding the State Machine. In the Flappy Bird lesson we have a transition between the TitleScreenState and the PlayState using the State Machine. However, when I run my program it is able to show the title screen without any issues, but when I press enter to begin playing, an error screen appears telling me that I attempted to call the method enter (a nil value) in my State Machine inside the change() method. I have compared both codes (mine and the lesson's) but there doesn't seem to be any difference whatsoever","",""
"379783803390001167","Highly Nonexistent#6057","18-Apr-20 02:05 AM","Nevermind, fixed it, my __include was missing an underscore","",""
"424665581887684609","ColdSnipez#8429","18-Apr-20 02:51 AM","I figured out how to run it ðŸ§©ðŸ§©ðŸ§©","",""
"181511246707818496","IkeKap#8206","18-Apr-20 03:13 AM","what ended up being the issue cold?","",""
"382732252205023243","Ferezza#1898","18-Apr-20 03:14 AM","Hi everybody, does anyone know what an init function is?@everyone","",""
"424665581887684609","ColdSnipez#8429","18-Apr-20 03:17 AM","Love was undefined so I defined it as global. Instead of opening just the file main.lua. I took the whole folder and opened main.lua from VS Code.","",""
"424665581887684609","ColdSnipez#8429","18-Apr-20 03:18 AM","Does that make sense?","",""
"382732252205023243","Ferezza#1898","18-Apr-20 03:21 AM","how do you define it as global? @ColdSnipez","",""
"424665581887684609","ColdSnipez#8429","18-Apr-20 03:34 AM","Do you have these similar problems in the output?","https://cdn.discordapp.com/attachments/462922474733174784/700866869808070706/image0.jpg",""
"181511246707818496","IkeKap#8206","18-Apr-20 03:35 AM","@ColdSnipez yup. I just set the filter to only tell me about errors not warnings or info","",""
"181511246707818496","IkeKap#8206","18-Apr-20 03:35 AM","@Ferezza do you have any OOD related knowledge? Essentially what an init is is a constructor for an object or struct","",""
"424665581887684609","ColdSnipez#8429","18-Apr-20 03:37 AM","So the way I fixed was by clicking on the warning sign âš ï¸ and it gave me two options. I forgot what those were. Can you click on them and tell me what it says?","",""
"181511246707818496","IkeKap#8206","18-Apr-20 03:38 AM","I think I know what you're talking about. It adds a piece of code to your files so that lua linter stops freaking out. You can also choose to ignore the nonsence warnings","",""
"424665581887684609","ColdSnipez#8429","18-Apr-20 03:42 AM","I need to get rid of those nonsense ones. But one of the solutions added the change for me and so I then restarted VS Code and added the folder ðŸ“ pong-0 and then ran main.lua using cmd + L (alt + L) and Love2D instantly launched.","",""
"424665581887684609","ColdSnipez#8429","18-Apr-20 03:42 AM","","https://cdn.discordapp.com/attachments/462922474733174784/700868808256127006/image0.jpg",""
"424665581887684609","ColdSnipez#8429","18-Apr-20 03:43 AM","Not sure if itâ€™s any different but you can see where I had opened the main.lua by itself and then you can see where I dragged the pong-0 folder and then opened main.lua from there.","",""
"181511246707818496","IkeKap#8206","18-Apr-20 03:51 AM","oh that .vscode thing is just a workspace settings thing for vscode","",""
"181511246707818496","IkeKap#8206","18-Apr-20 03:51 AM","that's how you define settings per workspace if you don't want to globally change the settings","",""
"181511246707818496","IkeKap#8206","18-Apr-20 03:51 AM","I use that to enable/disable certain extensions depending on my directory","",""
"672471131026096129","omdagoalie#1252","18-Apr-20 05:36 AM","hi so if i try to run this code it comes up with a syntax error anyone know how I can fix this?","",""
"672471131026096129","omdagoalie#1252","18-Apr-20 05:36 AM","(not ball.y == paddle.y) 
        if (ball.y < paddle.y) then","",""
"356528909057261581","jackyPitch#5451","18-Apr-20 06:26 AM","you don't need the () maybe ?","",""
"699833064657780767","vunran#6796","18-Apr-20 07:40 AM","@ColdSnipez what app are you using to edit your code","",""
"382732252205023243","Ferezza#1898","18-Apr-20 08:56 AM","guys im on flappy bird and im getting an error @o.o","https://cdn.discordapp.com/attachments/462922474733174784/700947925810937913/unknown.png",""
"525452465554980888","SKpower#2533","18-Apr-20 10:33 AM","Lmao why does it do that to everyone","",""
"525452465554980888","SKpower#2533","18-Apr-20 10:33 AM","Ur on Mac","",""
"382732252205023243","Ferezza#1898","18-Apr-20 12:13 PM","no im on windows @SKpower","",""
"524220681018277888","2019SHAH06/Aadit Shah#7061","18-Apr-20 02:17 PM","what editor does he use in the course?","",""
"577549284652744706","darth#2596","18-Apr-20 02:19 PM","vscode","",""
"524220681018277888","2019SHAH06/Aadit Shah#7061","18-Apr-20 02:20 PM","yup thought as much","",""
"524220681018277888","2019SHAH06/Aadit Shah#7061","18-Apr-20 02:21 PM","","https://cdn.discordapp.com/attachments/462922474733174784/701029660892332042/unknown.png",""
"524220681018277888","2019SHAH06/Aadit Shah#7061","18-Apr-20 02:21 PM","what additional tasks shud I choose","",""
"524220681018277888","2019SHAH06/Aadit Shah#7061","18-Apr-20 02:30 PM","@darth ??","",""
"577549284652744706","darth#2596","18-Apr-20 02:31 PM","It's cool, just go ahead.","",""
"424665581887684609","ColdSnipez#8429","18-Apr-20 03:09 PM","@vunran VS Code on MacOS","",""
"424665581887684609","ColdSnipez#8429","18-Apr-20 03:11 PM","I have both Mac and Windows. I just chose Mac because thatâ€™s what was on the presentation","",""
"602534380782485547","Xebind#9464","18-Apr-20 07:02 PM","To anyone experienced in Lua: I am getting this error, basically it says that timer is NULL. The thing is that I have no idea why it detects it as NULL. It's from Flappy Bird on assignment 1","https://cdn.discordapp.com/attachments/462922474733174784/701100262638616686/unknown.png",""
"602534380782485547","Xebind#9464","18-Apr-20 07:03 PM","Here is my code, after the countdown I am passing the bird position, pipes, timer, and score to the PlayState ( to keep them after pausing)","https://cdn.discordapp.com/attachments/462922474733174784/701100548128243802/unknown.png",""
"602534380782485547","Xebind#9464","18-Apr-20 07:04 PM","And this is the code on PlayState, which should receive the timer from CountdownState, which is set to 0, but for some reason receives Nil instead... any idea on what's going on?","https://cdn.discordapp.com/attachments/462922474733174784/701100861035905114/unknown.png",""
"625776180242677830","jsahil730#1900","18-Apr-20 07:45 PM","I have a small doubt in Flappy Bird. Can anyone help me with the same?","",""
"625776180242677830","jsahil730#1900","18-Apr-20 07:47 PM","Like professor defined a function in love.keyboard called wasPressed","",""
"625776180242677830","jsahil730#1900","18-Apr-20 07:47 PM","We could simply have created a new function in Bird class called maybe BIrd:keypress(key) and do the checking in that function","",""
"625776180242677830","jsahil730#1900","18-Apr-20 07:48 PM","And then call this function in love.keypressed","",""
"625776180242677830","jsahil730#1900","18-Apr-20 07:48 PM","Isn't this thing the more intuitive way to do things?","",""
"487520783988424714","monmanuela#5461","18-Apr-20 09:50 PM","@Xebind regarding timer as nil, did you enter the PlayState from somewhere else besides CountdownState and not pass in timer in the params?","",""
"602534380782485547","Xebind#9464","18-Apr-20 10:04 PM","> @Xebind regarding timer as nil, did you enter the PlayState from somewhere else besides CountdownState and not pass in timer in the params?
@monmanuela nope, the idea was to implement a PausedState and transition from Play->Paused->Countdown->Play, so I passed all the parameters from state to state. They are well defined in all this path until Countdown (i can print them in screen and they are fine) but then when passing to Play it disappears","",""
"281444541574414339","HadyDab#6004","18-Apr-20 11:21 PM","can someone please paste the github repository of the games  thanks in advance","",""
"198471648590954496","Luminescent#0001","19-Apr-20 02:09 AM","i need help with pong can anyone help","",""
"514938489947684890","vapor#0561","19-Apr-20 02:48 AM","in the pong video the instructor uses ""cd .."" in the terminal. what does that do?","",""
"514938489947684890","vapor#0561","19-Apr-20 02:50 AM","why does he use the terminal for that?","",""
"181511246707818496","IkeKap#8206","19-Apr-20 02:52 AM","@vapor cd stands for change directory. Cd .. takes you one directory up","",""
"181511246707818496","IkeKap#8206","19-Apr-20 02:53 AM","it's a terminal command","",""
"514938489947684890","vapor#0561","19-Apr-20 03:01 AM","why does he use them though?","",""
"514938489947684890","vapor#0561","19-Apr-20 03:01 AM","does that change the code editor file?","",""
"514938489947684890","vapor#0561","19-Apr-20 03:01 AM","like why does he need to use the terminal command?","",""
"181511246707818496","IkeKap#8206","19-Apr-20 03:03 AM","he doesn't need to. You can accomplish the same with windows explorer GUI. It's just a matter of preference and comfort","",""
"514938489947684890","vapor#0561","19-Apr-20 03:04 AM","what is windows explorer GUI?","",""
"514938489947684890","vapor#0561","19-Apr-20 03:05 AM","is that just the file explorer and opening it up through there?","",""
"181511246707818496","IkeKap#8206","19-Apr-20 03:06 AM","ye that's just the full name of it","",""
"514938489947684890","vapor#0561","19-Apr-20 03:06 AM","oh ok","",""
"514938489947684890","vapor#0561","19-Apr-20 03:06 AM","what code editor does he use?","",""
"181511246707818496","IkeKap#8206","19-Apr-20 03:07 AM","https://code.visualstudio.com/","",""
"514938489947684890","vapor#0561","19-Apr-20 03:07 AM","i cloned the repository to my computer, what should i do next?","",""
"181511246707818496","IkeKap#8206","19-Apr-20 03:08 AM","I'd open up the folder with vscode","",""
"181511246707818496","IkeKap#8206","19-Apr-20 03:09 AM","Install a few extensions to make it easier to edit the code","",""
"181511246707818496","IkeKap#8206","19-Apr-20 03:09 AM","also install love2d","",""
"514938489947684890","vapor#0561","19-Apr-20 03:11 AM","i already installed love2d","",""
"181511246707818496","IkeKap#8206","19-Apr-20 03:11 AM","@Luminescent what part of pong are you stuck on?","",""
"514938489947684890","vapor#0561","19-Apr-20 03:12 AM","@IkeKap I just installed vscode, what extension should I install?","",""
"212048965791776769","JackNet#2466","19-Apr-20 03:12 AM","idk if the pong assignment submission worked on my end. i had issues submitting it at first. idk, just want to make sure that doesnt haunt me in the end of the course.","",""
"181511246707818496","IkeKap#8206","19-Apr-20 03:14 AM","@vapor https://marketplace.visualstudio.com/items?itemName=pixelbyte-studios.pixelbyte-love2d to allow me to run code within vscode","",""
"181511246707818496","IkeKap#8206","19-Apr-20 03:14 AM","https://marketplace.visualstudio.com/items?itemName=sumneko.lua to do code blocks and linting","",""
"369877985769291786","Wolffyyâ¤#9324","19-Apr-20 03:22 AM","hi just joined","",""
"181511246707818496","IkeKap#8206","19-Apr-20 04:25 AM","hola!","",""
"430464051731234827","à¼¼ ã¤ â—•_â—• à¼½ã¤.TRAP#8632","19-Apr-20 04:27 AM","Help","https://cdn.discordapp.com/attachments/462922474733174784/701242423996842044/unknown.png",""
"430464051731234827","à¼¼ ã¤ â—•_â—• à¼½ã¤.TRAP#8632","19-Apr-20 04:56 AM","ðŸ˜","",""
"430464051731234827","à¼¼ ã¤ â—•_â—• à¼½ã¤.TRAP#8632","19-Apr-20 05:01 AM","@brian","",""
"212048965791776769","JackNet#2466","19-Apr-20 06:36 AM","getPixelScale got removed by lÃ¶ve 11","",""
"212048965791776769","JackNet#2466","19-Apr-20 06:36 AM","the course uses 10.2","",""
"212048965791776769","JackNet#2466","19-Apr-20 06:37 AM","replace getPixelScale with getDPIScale on the push script, or roll back to 10.2","","ðŸ‘ (5)"
"701118792859648040","rabbitpirate#4007","19-Apr-20 04:09 PM","Hey all, just starting out with this and already finding issues. At the moment I am having problems with pong2 and the love.graphics.clear(40, 45, 52, 255) line. I have tried the thing spicymeatballa suggested of changing the 255 to a 0, but all seems to do is set the background to black. I can't get it to display any other colour than that. Any suggestions? Thanks","",""
"524220681018277888","2019SHAH06/Aadit Shah#7061","19-Apr-20 04:22 PM",">","https://cdn.discordapp.com/attachments/462922474733174784/701422528278691900/unknown.png",""
"524220681018277888","2019SHAH06/Aadit Shah#7061","19-Apr-20 04:22 PM","what does this error mean","",""
"699833064657780767","vunran#6796","19-Apr-20 04:39 PM","Hi does anybody know how to submit the assignment Im having a problem in submitting","",""
"699833064657780767","vunran#6796","19-Apr-20 04:40 PM","> what does this error mean
@2019SHAH06/Aadit Shah it means that your push is too old for the love2d version you are using","",""
"699833064657780767","vunran#6796","19-Apr-20 04:40 PM","Try adding the new push.lua made","",""
"524220681018277888","2019SHAH06/Aadit Shah#7061","19-Apr-20 06:01 PM","I used the one from the course","",""
"642905839283470347","OppaDevil#8065","19-Apr-20 06:42 PM","@rabbitpirate maybe because you are using love2d 11. In love2d 11 the colors are from 0 to 1, so I think you should try to divide those values by 255","","ðŸ‘ (1)"
"181511246707818496","IkeKap#8206","19-Apr-20 06:42 PM","@2019SHAH06/Aadit Shah did you get the proper version of love2d?","",""
"642905839283470347","OppaDevil#8065","19-Apr-20 06:46 PM","","https://cdn.discordapp.com/attachments/462922474733174784/701458773524480000/Untitled.png",""
"642905839283470347","OppaDevil#8065","19-Apr-20 06:46 PM","Anyone knows how to fix it? The player is drawn there (I circle it near the heart). Everything is OK, he can move, can be damaged, can hit the button but he is not showed as expected! Thanks for helping!","",""
"351398452443217921","noobersauce456#5273","19-Apr-20 07:03 PM","@IkeKap Do you use the babelua extension for visual studio ?","",""
"181511246707818496","IkeKap#8206","19-Apr-20 07:04 PM","I use the standard love2d extension and standard lua extension","",""
"430464051731234827","à¼¼ ã¤ â—•_â—• à¼½ã¤.TRAP#8632","19-Apr-20 07:30 PM","Anyone have the correct version of love??","",""
"490479634396348428","steef#1527","19-Apr-20 07:32 PM","here you can download old versions of love: https://bitbucket.org/rude/love/downloads/","",""
"181511246707818496","IkeKap#8206","19-Apr-20 07:35 PM","you want version 0.10.2","",""
"490479634396348428","steef#1527","19-Apr-20 07:35 PM","in linux it is a bit of a hassle:
* uninstall love
* install the 0.10.2 *.deb files with eddy. 
* hold updates for love with synaptic. See https://www.linuxuprising.com/2018/10/how-to-keep-package-from-updating-in.html","",""
"430464051731234827","à¼¼ ã¤ â—•_â—• à¼½ã¤.TRAP#8632","19-Apr-20 07:36 PM","@IkeKap  Yes","",""
"430464051731234827","à¼¼ ã¤ â—•_â—• à¼½ã¤.TRAP#8632","19-Apr-20 07:36 PM","@IkeKap im on windows","",""
"181511246707818496","IkeKap#8206","19-Apr-20 07:36 PM","https://bitbucket.org/rude/love/downloads/love-0.10.2-win64.exe is the global install","",""
"430464051731234827","à¼¼ ã¤ â—•_â—• à¼½ã¤.TRAP#8632","19-Apr-20 07:37 PM","blank page","",""
"181511246707818496","IkeKap#8206","19-Apr-20 07:37 PM","https://bitbucket.org/rude/love/downloads/love-0.10.2-win64.zip is the local install","",""
"181511246707818496","IkeKap#8206","19-Apr-20 07:37 PM","@à¼¼ ã¤ â—•_â—• à¼½ã¤.TRAP it should download the exe or zip","",""
"490479634396348428","steef#1527","19-Apr-20 07:37 PM","then just install VScode, install the love 0.10.2, and do stuff","",""
"430464051731234827","à¼¼ ã¤ â—•_â—• à¼½ã¤.TRAP#8632","19-Apr-20 07:38 PM","","https://cdn.discordapp.com/attachments/462922474733174784/701471722528047194/unknown.png",""
"490479634396348428","steef#1527","19-Apr-20 07:39 PM","on the page i posted is this link: https://bitbucket.org/rude/love/downloads/love-0.10.2-win64.exe","",""
"490479634396348428","steef#1527","19-Apr-20 07:40 PM","not on a windows machine, but that link downloaded a exe with status 200","",""
"351398452443217921","noobersauce456#5273","19-Apr-20 07:55 PM","@IkeKap Could you please point me towards these extensions ? I can't find it in the visual studio marketplace","",""
"181511246707818496","IkeKap#8206","19-Apr-20 07:57 PM","> @vapor https://marketplace.visualstudio.com/items?itemName=pixelbyte-studios.pixelbyte-love2d to allow me to run code within vscode","",""
"181511246707818496","IkeKap#8206","19-Apr-20 07:57 PM","> @vapor https://marketplace.visualstudio.com/items?itemName=pixelbyte-studios.pixelbyte-love2d to allow me to run code within vscode","",""
"181511246707818496","IkeKap#8206","19-Apr-20 07:57 PM","whoops.. hopefully I didn't just ping that guy again","",""
