AuthorID,Author,Date,Content,Attachments,Reactions
"288745473026818050","persian cat#8436","16-Jul-19 09:51 PM","because i couldn't type in my terminal and reloaded and these showed up","",""
"288745473026818050","persian cat#8436","16-Jul-19 09:51 PM","what should i do","",""
"288745473026818050","persian cat#8436","16-Jul-19 09:56 PM","also","",""
"288745473026818050","persian cat#8436","16-Jul-19 09:56 PM","when i do","",""
"288745473026818050","persian cat#8436","16-Jul-19 09:56 PM","ls","",""
"288745473026818050","persian cat#8436","16-Jul-19 09:56 PM","in the terminal","",""
"288745473026818050","persian cat#8436","16-Jul-19 09:56 PM","its all white","",""
"288745473026818050","persian cat#8436","16-Jul-19 09:56 PM","but the stars are there","",""
"288745473026818050","persian cat#8436","16-Jul-19 09:57 PM","","https://cdn.discordapp.com/attachments/395684800830373888/600762822187679797/Screenshot_1.png",""
"288745473026818050","persian cat#8436","16-Jul-19 09:57 PM","see","",""
"288745473026818050","persian cat#8436","16-Jul-19 10:15 PM","ok now it works but it is still not color coded","",""
"288745473026818050","persian cat#8436","16-Jul-19 10:15 PM","does that matter>","",""
"288745473026818050","persian cat#8436","16-Jul-19 10:15 PM","?","",""
"393854278764068875","curiouskiwi#1671","17-Jul-19 12:03 AM","what's not color coded?  I wouldn't expect the `ls` list to be different colors","",""
"393854278764068875","curiouskiwi#1671","17-Jul-19 12:07 AM","oh, hmm...","",""
"288745473026818050","persian cat#8436","17-Jul-19 06:57 AM","make in ide is the same thing as clang right","",""
"288745473026818050","persian cat#8436","17-Jul-19 06:57 AM","i just do like make int if thats the program","",""
"288745473026818050","persian cat#8436","17-Jul-19 06:57 AM","if int is the program","",""
"288745473026818050","persian cat#8436","17-Jul-19 07:38 AM","i also started working on hello.c and im supposed to see a workspace folder but i do not","",""
"288745473026818050","persian cat#8436","17-Jul-19 07:38 AM","am i missing something?","",""
"459369317226774530","akshu3398#2481","17-Jul-19 07:44 AM","can someone help me, i am having problems when accessing cs50 ide - An error message with a sad face icon: signin.aws.amazon.com refused to connect. shows up.","",""
"355004524429049856","KENaKEN#6690","17-Jul-19 02:41 PM","Hi!
I still have  stuck on ""Preparing your environment"" issue. Is it not fixed yet? Anyone have the same problem?","",""
"374914470881001472","Kensocolo#1000","17-Jul-19 03:04 PM","Maybe refresh the page","",""
"593369406810226699","Jammar#8645","17-Jul-19 03:24 PM","^ that or try incognito mode or try different browser","",""
"355004524429049856","KENaKEN#6690","17-Jul-19 03:35 PM","Nothing helps 😦 I used Chrome (normal and incognito) and Firefox, result is the same.","",""
"593369406810226699","Jammar#8645","17-Jul-19 05:53 PM","@KENaKEN https://ide.cs50.io works fine for me. https://cs50.statuspage.io/ seems fine too. Probably the staff can help you.","",""
"355004524429049856","KENaKEN#6690","17-Jul-19 06:25 PM","Thank you @Jammar , I already wrote to sysadmins@cs50.harvard.edu","",""
"322973582432927757","kadavraverkisto#7943","17-Jul-19 06:38 PM","Mine seems to be working, but not very well - for example, saving a file takes a lot of time, typed characters appear with a lag etc.","",""
"288745473026818050","persian cat#8436","17-Jul-19 06:52 PM","my terminal only types a certain amount and then i have to reload","",""
"598014072587288608","hbolk#4005","17-Jul-19 07:34 PM","Hey,
Is the VIM configuration that Jordan uses available anywhere to replicate? That's actually pretty cool and I like to replicate that on my computer.","",""
"456226577798135808","Deleted User#0000","18-Jul-19 04:26 AM","hey I keep getting this error:","",""
"456226577798135808","Deleted User#0000","18-Jul-19 04:26 AM","Couldn't load node modules sqlite3 and sequelize from /home/ubuntu/.c9/node_modules node version: v12.6.0; node execPath /usr/bin/node Error: Cannot find module '/opt/c9/node_modules/sqlite3/lib/binding/node-v72-linux-x64/node_sqlite3.node' Require stack: - /opt/c9/node_modules/sqlite3/lib/sqlite3.js - /home/ubuntu/[eval] Error: Cannot find module '/opt/c9/node_modules/sqlite3/lib/binding/node-v72-linux-x64/node_sqlite3.node' Require stack: - /opt/c9/node_modules/sqlite3/lib/sqlite3.js - /home/ubuntu/[eval]
AWS Cloud9 detected you are missing one or more collab dependencies. Would you like to open the installer to update to the latest version?","",""
"456226577798135808","Deleted User#0000","18-Jul-19 04:26 AM","But when I  hit update nothing happens","",""
"456226577798135808","Deleted User#0000","18-Jul-19 04:26 AM","The popup doesn't even close","",""
"587007794125996033","Jackjack#2224","18-Jul-19 08:26 PM","Hi Guys, i am new to the CS50 and the IDE. i loged to the ide with my github account but i cant see any of my repositories . i just see an empty folder","",""
"587007794125996033","Jackjack#2224","18-Jul-19 11:55 PM","#GreenPsyduck Thank you!","",""
"288745473026818050","persian cat#8436","19-Jul-19 07:10 AM","is it fine if my main folder does not say workspace or if i havent done update 50?","",""
"393854278764068875","curiouskiwi#1671","19-Jul-19 07:12 AM","yes, in the new ide, that's to be expected.","",""
"288745473026818050","persian cat#8436","19-Jul-19 07:14 AM","ok","",""
"288745473026818050","persian cat#8436","19-Jul-19 07:15 AM","so it doesnt matter?","",""
"288745473026818050","persian cat#8436","19-Jul-19 07:15 AM","how do i submit then","",""
"288745473026818050","persian cat#8436","19-Jul-19 07:15 AM","log into CS50 IDE and open a terminal window, if not open already.

Submit Hello by executing:

cd ~/workspace/pset1/hello
submit50 cs50/2018/x/hello","",""
"288745473026818050","persian cat#8436","19-Jul-19 07:15 AM","it says do this","",""
"288745473026818050","persian cat#8436","19-Jul-19 07:16 AM","but i cant","",""
"288745473026818050","persian cat#8436","19-Jul-19 07:16 AM","becasue i dont have workspace or pset 1","",""
"288745473026818050","persian cat#8436","19-Jul-19 07:16 AM","i think i have the old instructions","",""
"288745473026818050","persian cat#8436","19-Jul-19 07:16 AM","where can i find the new ones","",""
"393854278764068875","curiouskiwi#1671","19-Jul-19 07:49 AM","why are you following the 2018 instructions?  Be sure you are using 2019","",""
"393854278764068875","curiouskiwi#1671","19-Jul-19 07:50 AM","https://docs.cs50.net/2019/x/psets/1/index.html","",""
"393854278764068875","curiouskiwi#1671","19-Jul-19 07:50 AM","you shouldn't need to use the IDE until problem set 3","",""
"393854278764068875","curiouskiwi#1671","19-Jul-19 07:52 AM","@persian cat the current year's materials are all linked from http://cs50.edx.org","",""
"288745473026818050","persian cat#8436","19-Jul-19 07:55 AM","@curiouskiwi 
i enrolled and paid for the certificate from 2018, do i have to repay for 2019?","",""
"393854278764068875","curiouskiwi#1671","19-Jul-19 07:56 AM","your dashboard should tell you when your verification expires.  But even if it's soon, you can ask edX to extend it.","",""
"288745473026818050","persian cat#8436","19-Jul-19 07:56 AM","it ends in spetmeber","",""
"288745473026818050","persian cat#8436","19-Jul-19 07:57 AM","ok","",""
"288745473026818050","persian cat#8436","19-Jul-19 07:57 AM","thanks","",""
"288745473026818050","persian cat#8436","19-Jul-19 08:01 AM","i enrolled in the 2019 but my courses still only say 2018","",""
"288745473026818050","persian cat#8436","19-Jul-19 08:01 AM","will that be a problem","",""
"288745473026818050","persian cat#8436","19-Jul-19 08:03 AM","@curiouskiwi","",""
"393854278764068875","curiouskiwi#1671","19-Jul-19 08:04 AM","go to the main page and be sure to choose 2019","",""
"393854278764068875","curiouskiwi#1671","19-Jul-19 08:04 AM","https://courses.edx.org/courses/course-v1:HarvardX+CS50+X/course/","",""
"393093317233082370","pos1tr0n#5427","19-Jul-19 09:28 AM","Is there a shortcut to switch from editor to terminal quickly?","",""
"393093317233082370","pos1tr0n#5427","19-Jul-19 09:29 AM","It's hard to take my hands off the keyboard to the mouse","",""
"322973582432927757","kadavraverkisto#7943","19-Jul-19 10:11 AM","Alt+S?","",""
"266971325254467584","Berky_Ross#6951","20-Jul-19 01:24 AM","Doesn't work Kad","",""
"393854278764068875","curiouskiwi#1671","20-Jul-19 01:27 AM","@pos1tr0n option-s","",""
"266971325254467584","Berky_Ross#6951","20-Jul-19 01:29 AM","what?","",""
"266971325254467584","Berky_Ross#6951","20-Jul-19 01:30 AM","what's this button ? @curiouskiwi","",""
"393854278764068875","curiouskiwi#1671","20-Jul-19 01:32 AM","you mean option?  on my keyboard, it's between control and command","",""
"160742798864154624","Huntlocker#4245","20-Jul-19 01:34 AM","alt+s works for me in the IDE, but not the sandbox/lab. option+s is just the mac/apple equivalent","",""
"393854278764068875","curiouskiwi#1671","20-Jul-19 01:36 AM","the sandbox doesn't have the keyboard shortcuts (it's a simplified interface)","",""
"160742798864154624","Huntlocker#4245","20-Jul-19 01:36 AM","Once the IDE is introduced is there frankly any reason to use the lab apart from the instructions on the side?","",""
"393854278764068875","curiouskiwi#1671","20-Jul-19 01:39 AM","once the IDE is introduced, you don't use the lab anymore","",""
"393093317233082370","pos1tr0n#5427","20-Jul-19 04:43 AM","Thank u bros alt-s (option-s for mac) works","",""
"374914470881001472","Kensocolo#1000","20-Jul-19 09:58 AM","Can anyone log into the IDE?","",""
"374914470881001472","Kensocolo#1000","20-Jul-19 09:59 AM","It says preparing your environment and then after a while the page just goes blank and is white","",""
"374914470881001472","Kensocolo#1000","20-Jul-19 10:02 AM","I got it to work in Chrome, does the site not work in Safari?","",""
"374914470881001472","Kensocolo#1000","20-Jul-19 10:03 AM","Yeah ide.cs50.io doesn't seem to work in Safari","",""
"296517760215941120","Raj#1113","20-Jul-19 10:37 AM","@Kensocolo I tried logging in a few hrs before but i wasn't able to","",""
"296517760215941120","Raj#1113","20-Jul-19 10:38 AM","maybe they're just in maintainance or something","",""
"374914470881001472","Kensocolo#1000","20-Jul-19 11:25 AM","It's working for me on chrome but not in safari","",""
"296517760215941120","Raj#1113","20-Jul-19 11:27 AM",":/","https://cdn.discordapp.com/attachments/395684800830373888/602054064410329108/unknown.png",""
"374914470881001472","Kensocolo#1000","20-Jul-19 11:29 AM","Huh weird","",""
"296517760215941120","Raj#1113","20-Jul-19 11:29 AM","","https://cdn.discordapp.com/attachments/395684800830373888/602054531253141505/unknown.png",""
"296517760215941120","Raj#1113","20-Jul-19 11:30 AM","welp, maybe it's just my internet acting up.","",""
"374914470881001472","Kensocolo#1000","20-Jul-19 11:36 AM","It might be","",""
"296517760215941120","Raj#1113","20-Jul-19 11:55 AM","yep it's working now","",""
"272727593881567242","GlazedPineapple#6969","22-Jul-19 11:20 PM","How can I put the IDE into dark mode?","",""
"393854278764068875","curiouskiwi#1671","23-Jul-19 12:51 AM","View Night Mode","",""
"295220103484669953","VangelisAndr#6126","24-Jul-19 01:35 AM","I'm trying to find crack.c which I've uploaded last year and I can't find it on Github. I can only find the following week's","",""
"295220103484669953","VangelisAndr#6126","24-Jul-19 01:35 AM","Have they been deleted?","",""
"393854278764068875","curiouskiwi#1671","24-Jul-19 01:57 AM","nothing is deleted, so if it's not in your github.com/submit50/  repo, are you sure you submitted it?","",""
"295220103484669953","VangelisAndr#6126","24-Jul-19 12:44 PM","Yeah because when I go to the submitted ones, it shows that I have submitted them","",""
"393854278764068875","curiouskiwi#1671","24-Jul-19 12:45 PM","so you see them here? http://cs50.me/submissions","",""
"295220103484669953","VangelisAndr#6126","24-Jul-19 12:48 PM","One sec","",""
"295220103484669953","VangelisAndr#6126","24-Jul-19 12:48 PM","Ignore me please","",""
"393854278764068875","curiouskiwi#1671","24-Jul-19 12:49 PM","ok. I'm shutting down for the night anyway.","",""
"248208770788884491","Nicholas Goldfinder#3350","24-Jul-19 06:43 PM","is it possible to download the ide and use it offline?","",""
"456226577798135808","Deleted User#0000","25-Jul-19 10:15 PM","I am having trouble accessing the CS50 IDE. I have signed in with my Github account and I keep getting a 403 error following the GET request for my IDE environment.","",""
"234679095378706433","Blauelf#6622","25-Jul-19 11:56 PM","The ide.cs50.io link, not the old cs50.io link, right?","",""
"456226577798135808","Deleted User#0000","26-Jul-19 12:41 AM","Correct 😃","",""
"456226577798135808","Deleted User#0000","26-Jul-19 02:46 AM","Hmmmm....just tried again and it's working now. Must have been the network I was connected to. ¯\_(ツ)_/¯","",""
"593369406810226699","Jammar#8645","26-Jul-19 03:23 PM","Omg I just disabled the red warning pop-up bar when file is not saved – now my terminal doesn't mess up anymore. so good.","",""
"255830618829488128","chikn#5000","26-Jul-19 05:16 PM","How did it mess up?","",""
"516835769072091167","michaeln#5505","26-Jul-19 06:17 PM","The IDE would not work in Firefox (went to blank screen) or Edge (timed out). Google Chrome is the only browser that works for me.","",""
"237287659561549824","Mersla#8466","26-Jul-19 07:05 PM","When submitting i get ""You have an unknown version of submit50"", status page says submit50 is working, what to do?","",""
"270039688843100170","Ghost-17#1479","26-Jul-19 07:40 PM","getting the same problem","",""
"357166762564780033","brian#1055","26-Jul-19 08:01 PM","@Mersla @Ghost-17 If you're using CS50 IDE, first run `sudo pip3 install --upgrade check50 submit50`, and then try re-running `submit50`!","","👍🏼 (2)"
"596597771994136588","torbs#1388","26-Jul-19 10:11 PM","[update]
I used ide.cs50.io instead which is much nicer anyway than the lab environment.
I'm getting this error message when trying to run submit50 using the lab environment:
You have an old version of submit50. Run update50, then re-run submit50!","",""
"603294110614552587","noob4ever#1127","27-Jul-19 03:05 AM","Does anyone else experience the terminal becoming unresponsive after saving a file? This happens to me about every third save.","",""
"593369406810226699","Jammar#8645","27-Jul-19 01:19 PM","@chikn  @michaeln  my terminal messed up because it, like, went out of bounds when the red-save popped up, so I couldn't see what I was writing (had to resize the terminal window every time). In Chrome.","",""
"254780208811343873","Animaster7#5593","28-Jul-19 04:56 AM","","https://cdn.discordapp.com/attachments/395684800830373888/604854752194330624/unknown.png",""
"254780208811343873","Animaster7#5593","28-Jul-19 04:57 AM","Broke check50","https://cdn.discordapp.com/attachments/395684800830373888/604854871283466244/unknown.png",""
"257661620656930820","Dave L.#2361","29-Jul-19 11:09 AM","Is check50 similar to how most Computer Science classes in college operate?","",""
"415254858745249796","HVossi92#8382","29-Jul-19 11:31 PM","hey, when running check50 cs50/2019/x/finance, I get: Could not find checks for cs50/2019/x/finance.
And when running submit50 cs50/2019/x/finance   , I get: Invalid slug: cs50/2019/x/finance
Submission cancelled.
Anyone having similar troubles?","",""
"415254858745249796","HVossi92#8382","29-Jul-19 11:31 PM","I did sudo pip3 install --upgrade check50 submit50 already","",""
"552746613223850004","the_3c0n0misT#1322","29-Jul-19 11:35 PM","^^ I have the same issue","",""
"415254858745249796","HVossi92#8382","29-Jul-19 11:39 PM","check50 cs50/problems/2019/x/finance seems like it might now my ide doesn't work anymore","",""
"178543252637483009","JZ#7525","30-Jul-19 04:51 PM","When I try to submit50 I get this error:
```
You have an unknown version of submit50. Email sysadmins@cs50.harvard.edu!
Submission cancelled.
```","",""
"552746613223850004","the_3c0n0misT#1322","30-Jul-19 05:02 PM","^","",""
"61883957838352384","Jelleas#3689","30-Jul-19 05:37 PM","@JZ Are you working in the CS50 IDE or in Sandbox/Labs?","",""
"178543252637483009","JZ#7525","30-Jul-19 07:23 PM","CS50 Ide @Jelleas, I just restarted the IDE which fixed my check50 problem for the #resize pset.  But now I'm faced with that issue.","",""
"61883957838352384","Jelleas#3689","30-Jul-19 07:34 PM","If you run `pip show submit50`, what version do you see?","",""
"178543252637483009","JZ#7525","30-Jul-19 08:37 PM","```
Name: submit50
Version: 3.0.0
Summary: This is submit50, with which you can submit solutions to problems for CS50.
Home-page: https://github.com/cs50/submit50
Author: CS50
Author-email: sysadmins@cs50.harvard.edu
License: GPLv3
Location: /usr/local/lib/python3.7/site-packages
Requires: lib50, requests, termcolor
Required-by:
```","",""
"178543252637483009","JZ#7525","30-Jul-19 08:37 PM","it's working again","",""
"178543252637483009","JZ#7525","30-Jul-19 08:38 PM","Then it asked me to reanble submit50","",""
"178543252637483009","JZ#7525","30-Jul-19 08:38 PM","and now it has cleared all of my submissions","",""
"178543252637483009","JZ#7525","30-Jul-19 08:38 PM","If I go to cs50.me it says I'm not enrolled in any courses","",""
"178543252637483009","JZ#7525","30-Jul-19 08:44 PM","Yup.. I have to go back to pset1  and resubmit everything","",""
"178543252637483009","JZ#7525","30-Jul-19 08:44 PM","because cs50 seems to have changed submit50 -> me50","",""
"178543252637483009","JZ#7525","30-Jul-19 08:54 PM","though I must say the new interface is much better","","❤ (1)"
"61883957838352384","Jelleas#3689","30-Jul-19 09:01 PM","You dont have to go back and resubmit everything. cs50.me/cs50x will pull results from both the old system and the new. Do make sure you visit cs50.me/cs50x and accept the pending invite there","",""
"178543252637483009","JZ#7525","30-Jul-19 09:07 PM","My list of programs at https://submit.cs50.io/courses/1 was blank even after that, it only took 5mins and so I just resubmitted everything","",""
"219295627459166208","VelocityIsntSpeed#9490","31-Jul-19 03:12 AM","Is there a way to use a custom font for the code editor? i want to use Anonymous Pro","",""
"393854278764068875","curiouskiwi#1671","31-Jul-19 03:17 AM","If you've got it installed on your machine, yes","",""
"393854278764068875","curiouskiwi#1671","31-Jul-19 03:17 AM","CS50 IDE > Preferences","",""
"393854278764068875","curiouskiwi#1671","31-Jul-19 03:18 AM","then scroll down to User Settings,  the Code Editor (Ace) and type in the font name at the front of the ""font family"" list","",""
"393854278764068875","curiouskiwi#1671","31-Jul-19 03:18 AM","","https://cdn.discordapp.com/attachments/395684800830373888/605917272183275523/fontide.png",""
"393854278764068875","curiouskiwi#1671","31-Jul-19 03:19 AM","@VelocityIsntSpeed ^^","",""
"219295627459166208","VelocityIsntSpeed#9490","31-Jul-19 03:23 AM","@curiouskiwi Thanks, i tried something similar before and it didn't work, but it worked now","",""
"602379920294805534","firedihm#8311","31-Jul-19 05:49 PM","IDE isn't loading for me. Anyone else experiencing such issues?","",""
"602379920294805534","firedihm#8311","31-Jul-19 05:52 PM","nvm it's okay now","",""
"603294110614552587","noob4ever#1127","31-Jul-19 08:19 PM","I have moved my legacy files to CS50's IDE. However, I don't see whodunnit. Does this look correct? Is there anything I need to do to update the environment? (the test directory is one I created of course)","https://cdn.discordapp.com/attachments/395684800830373888/606174024267202597/CS50IDE.PNG",""
"393854278764068875","curiouskiwi#1671","31-Jul-19 08:54 PM","whodunit was done in the Lab, not the IDE, so I wouldn't expect it to be there.","","👌 (1)"
"603294110614552587","noob4ever#1127","31-Jul-19 09:34 PM","@curiouskiwi  Ah. That makes sense. I'm not the quickest. Thank you!","",""
"371087494449594368","Nymex#6729","01-Aug-19 04:07 PM","aws cloud can not be created for me it gives me this","",""
"371087494449594368","Nymex#6729","01-Aug-19 04:07 PM","User: arn:aws:sts::265111720517:assumed-role/studentRole/9482523d-4cf2-4768-87d1-8510119e8b23 is not authorized to perform: cloud9:ValidateEnvironmentName on resource: *","",""
"371087494449594368","Nymex#6729","01-Aug-19 04:07 PM","how to solve pls?","",""
"371087494449594368","Nymex#6729","01-Aug-19 04:33 PM","?/","",""
"464855371790417930","hungover angel#4040","01-Aug-19 09:15 PM","hi everyone I'm having problems while trying to access the ide (slow, error messages)","",""
"393854278764068875","curiouskiwi#1671","01-Aug-19 09:36 PM","@Nymex what url are you on when you see that?  Are you going to https://ide.cs50.io ?","",""
"383289033054355456","HevyZz#0745","01-Aug-19 10:06 PM","@hungover angel yeah same here. It's been like that whole day","",""
"393854278764068875","curiouskiwi#1671","01-Aug-19 10:15 PM","https://cs50.statuspage.io/","",""
"371087494449594368","Nymex#6729","01-Aug-19 11:05 PM","No it is when i trying to create new environment in the aws service @curiouskiwi","",""
"393854278764068875","curiouskiwi#1671","01-Aug-19 11:09 PM","@Nymex you'd probably have to ask AWS about that then, if it's not CS50 related.","",""
"371087494449594368","Nymex#6729","01-Aug-19 11:11 PM","they say i do not have premission to make environment i already asked any my account created by cs50 i want premission pls","",""
"371087494449594368","Nymex#6729","01-Aug-19 11:11 PM","@curiouskiwi","",""
"393854278764068875","curiouskiwi#1671","01-Aug-19 11:12 PM","The CS50 ide is here: http://ide.cs50.io    where are you trying to log in?","",""
"371087494449594368","Nymex#6729","01-Aug-19 11:15 PM","when i open this it gives me white window","",""
"393854278764068875","curiouskiwi#1671","01-Aug-19 11:16 PM","can you send an email to sysadmins@cs50.harvard.edu with your github details and someone can help you","",""
"342168976123756548","A-A-RON#1271","02-Aug-19 08:47 PM","im taking the course on edX, how do i access the new IDE mentioned in week 3?","",""
"498539850841194526","vmars#4480","02-Aug-19 08:47 PM","i'm not sure how stupid this question is but when do you use the IDE vs the Sandbox for assignments?","",""
"342168976123756548","A-A-RON#1271","02-Aug-19 08:47 PM","nevermind just read the comment 2 lines above lol","",""
"498539850841194526","vmars#4480","02-Aug-19 08:47 PM","i'm only on week 2 so far","",""
"342168976123756548","A-A-RON#1271","02-Aug-19 08:47 PM","@vmars week 3 and on you start using the IDEA","",""
"342168976123756548","A-A-RON#1271","02-Aug-19 08:47 PM","IDE*","",""
"498539850841194526","vmars#4480","02-Aug-19 08:48 PM","thank you @A-A-RON","",""
"342168976123756548","A-A-RON#1271","02-Aug-19 08:48 PM","good luck on vigenere! 😃","",""
"342168976123756548","A-A-RON#1271","02-Aug-19 08:48 PM","does the IDE have something against safari? it won't load","",""
"342168976123756548","A-A-RON#1271","02-Aug-19 08:48 PM","same issue Nymex mentioned above","",""
"498539850841194526","vmars#4480","02-Aug-19 08:49 PM","i think you are supposed to use chrome for this class","",""
"498539850841194526","vmars#4480","02-Aug-19 08:49 PM","since it has a lot of built in software","",""
"342168976123756548","A-A-RON#1271","02-Aug-19 08:49 PM","well it does seem to work in chrome","",""
"498539850841194526","vmars#4480","02-Aug-19 08:51 PM","i'm like 98% positive that they said that you need to use chrome @A-A-RON","",""
"342168976123756548","A-A-RON#1271","02-Aug-19 08:58 PM","thx","",""
"219295627459166208","VelocityIsntSpeed#9490","03-Aug-19 01:36 PM","I use firefox without problems (i haven't reached the web development part though)","",""
"175877131253973001","ORdiCo#8686","06-Aug-19 07:57 AM","did something change recently? submit50 kept asking me for personal access tokens... it used to work with just username and password","",""
"393854278764068875","curiouskiwi#1671","06-Aug-19 07:58 AM","did you add 2 factor authentication to your github account recently?","",""
"175877131253973001","ORdiCo#8686","06-Aug-19 07:59 AM","2 factor was enabled bfore i started cs50","",""
"393854278764068875","curiouskiwi#1671","06-Aug-19 07:59 AM","we did change the submission system recently with new 'slugs'   go to http://submit.cs50.io  to make sure you have authed it","",""
"175877131253973001","ORdiCo#8686","06-Aug-19 07:59 AM","i did manage to submit but with personal access tokens","",""
"393854278764068875","curiouskiwi#1671","06-Aug-19 08:00 AM","i've always had to use tokens ever since I added 2FA to my github, so I'm not sure why you didn't have to?","",""
"175877131253973001","ORdiCo#8686","06-Aug-19 08:01 AM","oh...","",""
"175877131253973001","ORdiCo#8686","06-Aug-19 08:01 AM","that is so troublesome","",""
"175877131253973001","ORdiCo#8686","06-Aug-19 08:02 AM","the ssh method hangs on me tho","",""
"175877131253973001","ORdiCo#8686","06-Aug-19 08:02 AM","https://cs50.readthedocs.io/submit50/ <-- went here and theres a part which says i can use ssh instead","",""
"175877131253973001","ORdiCo#8686","06-Aug-19 08:03 AM","~/pset4/speller/ $ ssh git@github.com
ssh: connect to host github.com port 22: Connection timed out","",""
"175877131253973001","ORdiCo#8686","06-Aug-19 08:03 AM","😅","",""
"530135855415820288","Kontrary#1502","06-Aug-19 09:04 PM","Are there any official issues with the IDE?","",""
"530135855415820288","Kontrary#1502","06-Aug-19 09:04 PM","It's loading infinitely","",""
"530135855415820288","Kontrary#1502","06-Aug-19 09:04 PM","For me","",""
"342168976123756548","A-A-RON#1271","06-Aug-19 09:09 PM","@Kontrary use chrome","","👍 (1)"
"342168976123756548","A-A-RON#1271","06-Aug-19 09:10 PM","loads infinitely for me as well in safari","",""
