AuthorID,Author,Date,Content,Attachments,Reactions
"179575976148205590","Crok Lv1#2196","20-Mar-20 05:47 PM","I am going for my lunch","",""
"179575976148205590","Crok Lv1#2196","20-Mar-20 05:47 PM","good luck","",""
"179575976148205590","Crok Lv1#2196","20-Mar-20 05:47 PM","after verything's done","",""
"179575976148205590","Crok Lv1#2196","20-Mar-20 05:47 PM","git push origin nameOfTheBranch","",""
"179575976148205590","Crok Lv1#2196","20-Mar-20 05:47 PM","and that's it","",""
"364124725053489172","FinalPixel#9849","20-Mar-20 05:47 PM","god BLESS you dude","",""
"364124725053489172","FinalPixel#9849","20-Mar-20 05:47 PM","thanks so much","",""
"179575976148205590","Crok Lv1#2196","20-Mar-20 05:47 PM","you are welcome","",""
"364124725053489172","FinalPixel#9849","20-Mar-20 05:52 PM","oh noooooooo","",""
"364124725053489172","FinalPixel#9849","20-Mar-20 05:52 PM","","https://cdn.discordapp.com/attachments/462922474733174784/690588593957240872/unknown.png",""
"364124725053489172","FinalPixel#9849","20-Mar-20 06:23 PM","is it still fine? it says *some* refs after all...","",""
"489113470281973760","gonefishingâ˜…#0147","20-Mar-20 06:35 PM","Try `git push -u origin master`","",""
"364124725053489172","FinalPixel#9849","20-Mar-20 06:36 PM","i think i got it","",""
"364124725053489172","FinalPixel#9849","20-Mar-20 06:36 PM","thanks","","ðŸ‘ (1)"
"256195308491374592","Nolas#5654","20-Mar-20 07:07 PM","I'm having a problem on Assignment 8 and was hoping I could get some help with it. When I load up the distro, the Unity console says that the LightingData asset is incompatible with the version of Unity that I'm using even though I specifically downloaded the version used in the lecture. I've tried a few solutions that were supposed to work and I'm kind of at a loss for how to proceed. Any help is appreciated.","",""
"179575976148205590","Crok Lv1#2196","20-Mar-20 07:15 PM","are you using a render pipeline?","",""
"256195308491374592","Nolas#5654","20-Mar-20 07:16 PM","I have next to no unity experience, so if I could have this explained to me that'd be great","",""
"256195308491374592","Nolas#5654","20-Mar-20 07:17 PM","ok, I just looked into it, and no, I don't think I am","",""
"179575976148205590","Crok Lv1#2196","20-Mar-20 07:32 PM","Okay..","",""
"179575976148205590","Crok Lv1#2196","20-Mar-20 07:32 PM","I dont know then haha","",""
"179575976148205590","Crok Lv1#2196","20-Mar-20 07:37 PM","try saving stuff","",""
"179575976148205590","Crok Lv1#2196","20-Mar-20 07:37 PM","deleting","",""
"179575976148205590","Crok Lv1#2196","20-Mar-20 07:37 PM","and readding one by one","",""
"179575976148205590","Crok Lv1#2196","20-Mar-20 07:37 PM","maybe some sprite is using something it shouldnt","",""
"179575976148205590","Crok Lv1#2196","20-Mar-20 07:37 PM","or undesired package was installed","",""
"256195308491374592","Nolas#5654","20-Mar-20 07:38 PM","I figured out what was wrong, for some reason, Unity wasn't loading the scene, but I thought it was because of the errors that were being thrown when I opened the distro. And as it turned out, the errors had no bearing on the scene not loading, it was all operator error","",""
"256195308491374592","Nolas#5654","20-Mar-20 07:39 PM","anyway, it's all good now, and I can finally get to work on this","",""
"179575976148205590","Crok Lv1#2196","20-Mar-20 07:45 PM","how did you fixed it?","",""
"256195308491374592","Nolas#5654","20-Mar-20 08:00 PM","it's gonna sound really dumb, but I had to manually open the scene. I was double-clicking the scene folder, thinking that it was going to open the scene, which wasn't actually the case. I don't know why I didn't think to manually open it from the start, I have a tendency to grossly overcomplicate things","",""
"446444086203908106","oiler#8225","20-Mar-20 10:17 PM","Anyone know if Unity is available on Linux","",""
"213897389516390401","geamoWXZY7#6543","21-Mar-20 01:45 AM","> @geamoWXZY7 I've got it working on Catalina so maybe I can help. Where and how did you install Love? I grabbed 0.10.2 from here: https://bitbucket.org/rude/love/downloads/, I downloaded the love-0.10.2-macosx-x64.zip, unzipped it and copied it to my applications folder. I've just tried it now and noticed that dragging and dropping doesn't seem to work with this version, but I do it from the command line. So try `/Applications/love.app/Contents/MacOS/love ~/path/to/mygame` and see if that works (assuming you called the love2d app ""love"". If it does you can add love to your path, there are instructions here: https://love2d.org/wiki/Getting_Started
@Ben Attenborough Amazing, thank you! Honestly I have no idea why this worked when what I did didn't (since I tried both command line and not, with the same version)... It might be because it's in the Application folder specifically? Mine was just in Downloads. Anyways, either way you're a lifesaver and now I can continue the course!","",""
"278061751822450701","The Little Giant#8873","21-Mar-20 07:01 PM","anyone know why space or the mouse input doesnt work? idk i just switched the input for the flappy bird to make it jump to w and it works but when its for space or right or left click it doesnt","",""
"278061751822450701","The Little Giant#8873","21-Mar-20 07:02 PM","oh nvm i got it to work for space but anyone know how to get the mouse input to work","",""
"179575976148205590","Crok Lv1#2196","22-Mar-20 03:17 AM","@oiler  Unity's linux version is 100% unstable. Avoid it","",""
"446444086203908106","oiler#8225","22-Mar-20 03:18 AM","@Crok Lv1 ah alright. I have a Windows machine but I rarely use it","",""
"446444086203908106","oiler#8225","22-Mar-20 03:18 AM","And was thinking of doing some game dev during quarantine season","",""
"342054148012769284","kappilino#9875","22-Mar-20 04:08 PM","The Unreal Engine is also available for Linux. But only in source code. So you have to compile it. Or you take the Godot Engine. Fully OpenSource and a very good linux experience out-of-the-box ðŸ˜ƒ","",""
"305420653732036608","Patrick Machado - Brazil#0262","22-Mar-20 04:10 PM","Hey guys have u ever had access expiration on a course on cs50? i tough that it couldnt even happens now idk how to re-access my course ðŸ˜¦","",""
"305420653732036608","Patrick Machado - Brazil#0262","22-Mar-20 04:10 PM","any hint?","",""
"246033603329392651","guilleacq#9467","22-Mar-20 04:25 PM","This is the first time I am taking cs50 and actually working on an online course actively, but perhaps you've reached the end of the year deadline?","",""
"246033603329392651","guilleacq#9467","22-Mar-20 04:26 PM","I don't know how that works but it's the only thing I can think about","",""
"568482890384408607","Salik#2594","22-Mar-20 08:24 PM","Can someone Help me with git","",""
"568482890384408607","Salik#2594","22-Mar-20 08:24 PM","Can someone tell me how to upload assignments","",""
"305420653732036608","Patrick Machado - Brazil#0262","22-Mar-20 09:57 PM","@guilleacq probably yeas but people have told me that the exclusation from the course never happened, now i sorta dont have acces to it ðŸ˜¦","",""
"179575976148205590","Crok Lv1#2196","23-Mar-20 01:03 AM","@Salik Allow the assignment CS50 have access to your Github or something like that","",""
"179575976148205590","Crok Lv1#2196","23-Mar-20 01:04 AM","So you will have the me50/USERNAME.git thing","",""
"179575976148205590","Crok Lv1#2196","23-Mar-20 01:04 AM","then do this:
git init
git remote add origin repositoryName
git add .
git commit -m ""Finished task or something""
git push origin nameOfTheBranch","",""
"179575976148205590","Crok Lv1#2196","23-Mar-20 01:04 AM","repositoryName is going to be the me50/YOURGITHUBUSERNAME.git","",""
"510696373386215435","JEDTHEI#2431","23-Mar-20 11:33 PM","so i need some advice","",""
"510696373386215435","JEDTHEI#2431","23-Mar-20 11:35 PM","so I'm making a top down shooter in unity and i don't know weather to make the script for all the different variables for the guns (like ammo reload speed damage) and im not sure if i should make one giant script housing all of this information or tiny separate scripts for each gun","",""
"179575976148205590","Crok Lv1#2196","23-Mar-20 11:36 PM","So here is the thing","",""
"179575976148205590","Crok Lv1#2196","23-Mar-20 11:36 PM","are you a programmer?","",""
"510696373386215435","JEDTHEI#2431","23-Mar-20 11:37 PM","ya","",""
"179575976148205590","Crok Lv1#2196","23-Mar-20 11:37 PM","Idk how complex is your guns","",""
"179575976148205590","Crok Lv1#2196","23-Mar-20 11:37 PM","But I would suggest you to separate in different scripts every functionality","",""
"179575976148205590","Crok Lv1#2196","23-Mar-20 11:37 PM","or something like that","",""
"179575976148205590","Crok Lv1#2196","23-Mar-20 11:38 PM","it's never good to make big ass codes","",""
"179575976148205590","Crok Lv1#2196","23-Mar-20 11:38 PM","or to make a single function takes too much responsibilities","",""
"510696373386215435","JEDTHEI#2431","23-Mar-20 11:38 PM","ya i think that will be a little cleaner i just dont know how im going to refrence that between the script that makes it shoot","",""
"179575976148205590","Crok Lv1#2196","23-Mar-20 11:39 PM","I could help you but I dont know how you are architecturing it","",""
"179575976148205590","Crok Lv1#2196","23-Mar-20 11:40 PM","But try to avoid high accoplation","",""
"179575976148205590","Crok Lv1#2196","23-Mar-20 11:40 PM","even more try to avoid too much inheritance","",""
"179575976148205590","Crok Lv1#2196","23-Mar-20 11:41 PM","if you ever need help dm me and I will try.","",""
"510696373386215435","JEDTHEI#2431","23-Mar-20 11:43 PM","ok thx","",""
"179575976148205590","Crok Lv1#2196","23-Mar-20 11:54 PM","np","",""
"356528909057261581","jackyPitch#5451","24-Mar-20 03:06 AM","hello i'm just starting the CS50's Introduction to Game Development, i just want to know, is there any exercizes ?","",""
"510696373386215435","JEDTHEI#2431","24-Mar-20 05:59 AM","@jackyPitch im not sure if you mean in the course but for game development in general a would recommend a game jam","",""
"356528909057261581","jackyPitch#5451","24-Mar-20 01:17 PM","@JEDTHEI thank you for your answers, i was thinking in the course yep, do you know where i can find regular game jam ?","",""
"367705769207922689","migoo#9349","24-Mar-20 04:36 PM","does anyone know what version of lua, GD50 uses and the best IDE for it?","",""
"356528909057261581","jackyPitch#5451","24-Mar-20 07:04 PM","@migoo i'm looking for the same answer, currently i use the LuaDevelopmentTool ( https://www.eclipse.org/ldt/ ) but i don't find it very useful, so if anyone else have something better to advice!","",""
"510696373386215435","JEDTHEI#2431","24-Mar-20 08:00 PM","@jackyPitch itch.io is a good place to post your games and find comminty game jams","",""
"356528909057261581","jackyPitch#5451","24-Mar-20 09:33 PM","@JEDTHEI thank you i'll take a look","",""
"364124725053489172","FinalPixel#9849","24-Mar-20 10:31 PM","yo im working on assignment 1, and i need to put in the medals","",""
"364124725053489172","FinalPixel#9849","24-Mar-20 10:31 PM","im able to make it so that they appear on the score screen, however theyre MASSIVE","",""
"364124725053489172","FinalPixel#9849","24-Mar-20 10:32 PM","is there a way to resize an image without making a separate class?","",""
"284818751004737536","futtuttu#7907","24-Mar-20 11:30 PM","hello, i just started the course, watched the first lecture, but i just can't get to boot lua to start the first assignment, can anyone help me?","",""
"364124725053489172","FinalPixel#9849","24-Mar-20 11:39 PM","@futtuttu make a new folder (named game dev course or whatever you want), put everything that you downloaded for love (make sure its version 0.9.2) in that folder. get the folder for the full final version of the pong game and put it in the folder (game dev). from there you drag the full folder onto love.exe and it should run. Also, and this should be an obvious one, but make sure you open each pong folder into a text editing software (and not just copying and pasting. actually opening it) so that when you change something that it actually changes","",""
"284818751004737536","futtuttu#7907","24-Mar-20 11:50 PM","ok thank you, will try that later","",""
"266433660511584256","Kashintaka#0349","25-Mar-20 12:50 AM","Hey, @The Little Giant I had the same problem and I can't fix it. I would like to know if you figured how to fix this, if so, could you help me?","",""
"266433660511584256","Kashintaka#0349","25-Mar-20 12:51 AM","I tried removing the ""()"" from the ""getPixelScale"" and it did work out buut, from pong-2 it runs only a white screen even thogh the commands still works","",""
"266433660511584256","Kashintaka#0349","25-Mar-20 12:52 AM","","https://cdn.discordapp.com/attachments/462922474733174784/692143778697576528/Captura_de_Tela_22.png",""
"310375915190484992","Kazaki#5116","25-Mar-20 01:10 AM","Someone knows what is the ADI that he is using?","https://cdn.discordapp.com/attachments/462922474733174784/692148352003080192/unknown.png",""
"469756465863983124","Fer#1196","25-Mar-20 01:12 AM","> change all the `getPixelScale()` for `getDPIScale()` @Kashintaka , it's the newer version of the function","",""
"266433660511584256","Kashintaka#0349","25-Mar-20 01:12 AM","thank you very much!","","ðŸ‘ (1)"
"469756465863983124","Fer#1196","25-Mar-20 01:13 AM","ðŸ™‚","",""
"310375915190484992","Kazaki#5116","25-Mar-20 01:13 AM","> Someone knows what is the ADI that he is using?
@Kazaki ???","",""
"469756465863983124","Fer#1196","25-Mar-20 01:14 AM","also you have to change the scales for the colors whenever you draw something to the screen. The scale must go from 0 -1 instead of 0 -255. @Kashintaka","",""
"469756465863983124","Fer#1196","25-Mar-20 01:15 AM","what do you mean by ADI? @Kazaki","",""
"310375915190484992","Kazaki#5116","25-Mar-20 01:15 AM","ADI it's the place that he is using to programming","",""
"310375915190484992","Kazaki#5116","25-Mar-20 01:17 AM","ADI is a Brazilian acronym","",""
"469756465863983124","Fer#1196","25-Mar-20 01:18 AM","I see, you refer to the IDE. It's Visual Studio Code @Kazaki","",""
"310375915190484992","Kazaki#5116","25-Mar-20 01:18 AM","Yes!","",""
"179575976148205590","Crok Lv1#2196","25-Mar-20 01:18 AM","holy shit","",""
"179575976148205590","Crok Lv1#2196","25-Mar-20 01:18 AM","too many problems","",""
"469756465863983124","Fer#1196","25-Mar-20 01:18 AM","Use english dud, come one","",""
"310375915190484992","Kazaki#5116","25-Mar-20 01:18 AM","sorry","","ðŸ‘ (1)"
"179575976148205590","Crok Lv1#2196","25-Mar-20 01:18 AM","@Kashintaka Downgrade your Love version to 0.10.2","",""
"266433660511584256","Kashintaka#0349","25-Mar-20 01:19 AM","god, why you hate me","",""
"266433660511584256","Kashintaka#0349","25-Mar-20 01:19 AM","ok, I'll do it","",""
"310375915190484992","Kazaki#5116","25-Mar-20 01:19 AM","> I see, you refer to the IDE. It's Visual Studio Code @Kazaki
@Fer Yes, but what it the IDE that he's using?","",""
"469756465863983124","Fer#1196","25-Mar-20 01:20 AM","Visual Studio Code xD","",""
"310375915190484992","Kazaki#5116","25-Mar-20 01:20 AM","Ok, thanks","",""
"179575976148205590","Crok Lv1#2196","25-Mar-20 02:40 AM","Dont know which IDE to use? VS Code probably has a bunch of extensions regardless of the chosen programmin language xD","",""
"532878986724900864","gÐ°briel#5246","25-Mar-20 04:27 AM","hello again. I'm trying to debug pong zero but an error appears: ""cannot find runtime 'node' on path. is 'node' installed?"" I've looked for some solutions on stackoverflow and other sites, but nothing has solved this problem so far. does anyone know a solution?
I reposted from another chat because I think it is more appropriate here (maybe)","",""
"278061751822450701","The Little Giant#8873","25-Mar-20 06:34 AM","@Kashintaka did that fix your issue? If not I downgraded to 0.9.2 and it works","",""
"412858195510558727","Sufya (âš¬âƒ”âš¬ï¼®âš¬âƒ”âš¬)#4772","25-Mar-20 09:55 AM","I am doing Assignment 1 rn and having problems implementing pause feature. So, I made a PauseState class that i would jump to from the PlayState whenever the user presses 'p'. But when i do that I get these errors","",""
"412858195510558727","Sufya (âš¬âƒ”âš¬ï¼®âš¬âƒ”âš¬)#4772","25-Mar-20 09:55 AM","attempt to call global 'PauseState' (a nil value)
stack traceback:
        main.lua:114: in function <main.lua:114>
        StateMachine.lua:54: in function 'change'
        states/PlayState.lua:105: in function 'update'
        StateMachine.lua:59: in function 'update'
        main.lua:166: in function 'update'
        [string ""boot.lua""]:464: in function <[string ""boot.lua""]:436>
        [C]: in function 'xpcall'","",""
"412858195510558727","Sufya (âš¬âƒ”âš¬ï¼®âš¬âƒ”âš¬)#4772","25-Mar-20 09:56 AM","I've also added the class in gStateMachine list in main.lua","",""
"412858195510558727","Sufya (âš¬âƒ”âš¬ï¼®âš¬âƒ”âš¬)#4772","25-Mar-20 09:57 AM","Any help on what I might be doing wrong","",""
"469756465863983124","Fer#1196","25-Mar-20 11:57 AM","Did you already added the class to the Dependencies.lua file? @Sufya (âš¬âƒ”âš¬ï¼®âš¬âƒ”âš¬)","",""
"284818751004737536","futtuttu#7907","25-Mar-20 08:40 PM","can anyone help me please? iÂ´ve got the files for assignment 0 in a visual studio file but love2D keeps saying there is an error and wonÂ´t open the file","",""
"256195308491374592","Nolas#5654","25-Mar-20 08:41 PM","how exactly are you storing the files","",""
"284818751004737536","futtuttu#7907","25-Mar-20 08:41 PM","forget about it, already got it to work, thanks","",""
"256195308491374592","Nolas#5654","25-Mar-20 08:42 PM","good on you","",""
"532878986724900864","gÐ°briel#5246","25-Mar-20 08:56 PM","can someone who has been through this problem help me? I've looked on several sites but nothing solved : (","https://cdn.discordapp.com/attachments/462922474733174784/692446803295076462/Captura_de_Tela_1.png",""
"227524944672587776","Drewon#0021","25-Mar-20 10:34 PM","I have a little issue with assignment 5, Zelda. I'm trying to implement collisions and i wanted to do it in EntityWalkState:update so that it affects everyone + that's where wall collisions are calculated and movement is finalized","",""
"227524944672587776","Drewon#0021","25-Mar-20 10:35 PM","but im having issues finding out how to use / pass it the current room parameter, so that it can access the current objects table to check collisions with objects","",""
"227524944672587776","Drewon#0021","25-Mar-20 10:35 PM","aka pot f.ex","",""
"227524944672587776","Drewon#0021","25-Mar-20 10:47 PM","I mean, I imagine I'm supposed to add them there since movement is finalized there and if i add it to playerwalkstate it will shake since i have to change the x and y AFTER they have already been changed in entitywalkstate","",""
"227524944672587776","Drewon#0021","25-Mar-20 10:47 PM","but i just can't figure out how to access the objects array","",""
"225723250347474945","buggyhydra#5768","25-Mar-20 10:50 PM","hi.","",""
"225723250347474945","buggyhydra#5768","25-Mar-20 10:50 PM","i am terribly sorry to ask such noob question..but","",""
"225723250347474945","buggyhydra#5768","25-Mar-20 10:50 PM","this is my first time running visual code","",""
"225723250347474945","buggyhydra#5768","25-Mar-20 10:51 PM","i could not even manage to run the main.lua in the first lecture of pong course","",""
"225723250347474945","buggyhydra#5768","25-Mar-20 10:51 PM","how to make it work?","",""
"225723250347474945","buggyhydra#5768","25-Mar-20 10:51 PM","i receive this error ""setting the outfiles attribute might help""","",""
"364124725053489172","FinalPixel#9849","25-Mar-20 10:52 PM","(this is just a copy paste of an answer i had before idk if itll help you a ton tho) make a new folder (named game dev course or whatever you want), put everything that you downloaded for love (make sure its version 0.9.2) in that folder. get the folder for the full final version of the pong game and put it in the folder (game dev). from there you drag the full folder onto love.exe and it should run. Also, and this should be an obvious one, but make sure you open each pong folder into a text editing software (and not just copying and pasting. actually opening it) so that when you change something that it actually changes","",""
"225723250347474945","buggyhydra#5768","25-Mar-20 10:53 PM","course related git files into the lÃ¶ve folder?","",""
"364124725053489172","FinalPixel#9849","25-Mar-20 10:54 PM","well thats more to make it easier to access","",""
"364124725053489172","FinalPixel#9849","25-Mar-20 10:54 PM","you just need to be able to drag the file onto love 0.9.2","",""
"225723250347474945","buggyhydra#5768","25-Mar-20 10:55 PM","everything downloaded yesterday","",""
"364124725053489172","FinalPixel#9849","25-Mar-20 10:55 PM","do you want to go into voice chat so i can go live and show you what i did?","",""
"225723250347474945","buggyhydra#5768","25-Mar-20 10:56 PM","sure","",""
"225723250347474945","buggyhydra#5768","25-Mar-20 10:56 PM","#general?","",""
"364124725053489172","FinalPixel#9849","25-Mar-20 10:57 PM","ye","",""
"225723250347474945","buggyhydra#5768","25-Mar-20 10:57 PM","joined","",""
"267077104120627202","Ivo - magthin#5582","25-Mar-20 11:46 PM","any can help me?","",""
"267077104120627202","Ivo - magthin#5582","25-Mar-20 11:47 PM","when i play my lua script, it go to white screen","",""
"267077104120627202","Ivo - magthin#5582","25-Mar-20 11:48 PM","but it go starting pong 3","",""
"267077104120627202","Ivo - magthin#5582","25-Mar-20 11:49 PM","and i no know how, or where i can resolve that error","",""
"532878986724900864","gÐ°briel#5246","25-Mar-20 11:55 PM","can someone tell me how colton debugs on visual studio code? (i think i'm doing something wrong)","",""
"267077104120627202","Ivo - magthin#5582","26-Mar-20 12:06 AM","sou br","",""
"267077104120627202","Ivo - magthin#5582","26-Mar-20 12:07 AM","me ajuda man privado pls","",""
"267077104120627202","Ivo - magthin#5582","26-Mar-20 12:17 AM","i've found a solution, thank you","",""
"532878986724900864","gÐ°briel#5246","26-Mar-20 12:31 AM","uÃ©","",""
"267077104120627202","Ivo - magthin#5582","26-Mar-20 12:43 AM","rsrsrsr","",""
"299563519102156810","Alexander#4377","26-Mar-20 01:49 AM","In the assignment for lecture 1 it says you need to make a video where you demonstrate how your code works and upload it, is this optional or required?","",""
"393854278764068875","curiouskiwi#1671","26-Mar-20 02:14 AM","required","",""
"608313824625557514","mulhammad avdol#3727","26-Mar-20 03:51 AM","when are the assignments due? sorry, I never did an online course before","",""
"393854278764068875","curiouskiwi#1671","26-Mar-20 03:52 AM","CS50 Games is self-paced with a final deadline of 31 Dec 2020.","",""
"608313824625557514","mulhammad avdol#3727","26-Mar-20 03:52 AM","I see, thanks","",""
"367306334317838336","iG0tB0lts#5803","26-Mar-20 07:23 AM","Hi guys","",""
"367306334317838336","iG0tB0lts#5803","26-Mar-20 07:23 AM","I wanted a bit of help understanding how the stateMachine works in flappy bird","",""
"367306334317838336","iG0tB0lts#5803","26-Mar-20 07:23 AM","Everytimme the state is changed, say I'm going from title to play, is a new playState object created ?","",""
"469756465863983124","Fer#1196","26-Mar-20 07:50 AM","yes, it instantiate the play class every time.","https://cdn.discordapp.com/attachments/462922474733174784/692611388010659862/unknown.png",""
"469756465863983124","Fer#1196","26-Mar-20 07:51 AM","so, it runs the init and enter function every time @iG0tB0lts","",""
"367306334317838336","iG0tB0lts#5803","26-Mar-20 08:02 AM","Thanks fer","","ðŸ‘ (1)"
"367306334317838336","iG0tB0lts#5803","26-Mar-20 08:03 AM","One more question, should I pause the background scrolling for the pause objective of the assignment 1 ?","",""
"469756465863983124","Fer#1196","26-Mar-20 08:08 AM","i did so, yes","",""
"692228506800750652","roboman6#4452","27-Mar-20 08:30 AM","Hi everyone, for assignment0 I am trying to make a class to generate commands for player2 but when I try to instantiate it I get this error :Error

main.lua:103: attempt to call global 'AIInput' (a table value)


Traceback

main.lua:103: in function 'load'
[C]: in function 'xpcall'
[C]: in function 'xpcall'","",""
"692228506800750652","roboman6#4452","27-Mar-20 08:31 AM","here is the code","https://cdn.discordapp.com/attachments/462922474733174784/692984142991982652/unknown.png",""
"692228506800750652","roboman6#4452","27-Mar-20 08:32 AM","","https://cdn.discordapp.com/attachments/462922474733174784/692984426942169099/unknown.png",""
"692228506800750652","roboman6#4452","27-Mar-20 08:33 AM","","https://cdn.discordapp.com/attachments/462922474733174784/692984632404344832/unknown.png",""
"692228506800750652","roboman6#4452","27-Mar-20 08:34 AM","Can someone tell me what I am doing wrong?","",""
"469756465863983124","Fer#1196","27-Mar-20 11:53 AM","@roboman6  you are declaring the AIInput class wrong. See image.","https://cdn.discordapp.com/attachments/462922474733174784/693034942241701949/Screen_Shot_2020-03-27_at_3.53.08.png",""
"367306334317838336","iG0tB0lts#5803","27-Mar-20 12:09 PM","In the gameStateMachine of flappy bird, is there anyway I can acquire the current gamestate in main.lua ?","",""
"412858195510558727","Sufya (âš¬âƒ”âš¬ï¼®âš¬âƒ”âš¬)#4772","27-Mar-20 01:23 PM","have you tried gStateMachine.current","",""
"367306334317838336","iG0tB0lts#5803","27-Mar-20 03:48 PM","Yes but I went ahead and implemented a returnState() function","",""
"367306334317838336","iG0tB0lts#5803","27-Mar-20 03:49 PM","If I need to resubmit my assignment, should I just go ahead and submit50 one more time ?","",""
