AuthorID,Author,Date,Content,Attachments,Reactions
"393854278764068875","curiouskiwi#1671","30-Dec-17 02:44 AM","what kind of mode?","",""
"98344592641916928","therewolf#7605","30-Dec-17 09:18 PM","@😎 77Whaleman77 😎#0808 Still not sure what mode you're talking about. Do you mean the color theme?","",""
"98344592641916928","therewolf#7605","30-Dec-17 10:28 PM","You can open Preferences by clicking the ""CS50 IDE"" button in the upper left or by hitting Ctrl+,","",""
"98344592641916928","therewolf#7605","30-Dec-17 10:28 PM","and there is a section for Themes","",""
"344668731789803521","milo yiannopoulos#2669","01-Jan-18 04:11 AM","any way I can make fuschia the main color theme?","",""
"161289504747945984","LiberaVeritas#1294","01-Jan-18 04:13 AM","It looks like the ide lets you make your own stylesheet, if you feel like looking up how to make one","",""
"394586780810346496","Baris Can Ceylan#4867","07-Jan-18 01:46 AM","hi there! does anyone know if is there a way to collapse code blocks?","",""
"393854278764068875","curiouskiwi#1671","07-Jan-18 01:55 AM","@Baris Can Ceylan go to Preferences and then scroll down to User Settings and under that Code Editor (Ace).  Click that and then you'll see Code Folding as one of the options","","👍 (1)"
"394586780810346496","Baris Can Ceylan#4867","07-Jan-18 02:03 AM","wow, didn't realised this was indeed a fully featured ide","",""
"399913366593994762","stuart_clark#0463","08-Jan-18 03:37 PM","When i change theme of cs50ide,  it does not change the theme?","",""
"220190968354177025","kilolo#5578","10-Jan-18 11:03 AM","I was recently finished a video by Doug Lloyd about Conditional statements and got stuck on the (?:) statement","https://cdn.discordapp.com/attachments/395684800830373888/400575457621311491/Untitled_picture.png",""
"373970003113934849","maximize_both#4929","10-Jan-18 11:04 AM","IF it's anything like JS that is just a more compact way of doing IF / ELSE statement","",""
"373970003113934849","maximize_both#4929","10-Jan-18 11:05 AM","The condition being checked is to the left of ?... the statement enacted if that is true is to the left of colon, the statement enacted otherwise is to the right of colon","",""
"373970003113934849","maximize_both#4929","10-Jan-18 11:06 AM","https://www.geeksforgeeks.org/cc-ternary-operator-some-interesting-observations/","",""
"373970003113934849","maximize_both#4929","10-Jan-18 11:07 AM","Yes, it goes over it here","",""
"373970003113934849","maximize_both#4929","10-Jan-18 11:07 AM","it's a little wonky at first, but it's pretty cool... in your example it's assigning a different value to a variable depending on the result of checking IF something is true","",""
"220190968354177025","kilolo#5578","10-Jan-18 11:12 AM","i dont understand this <iostream> program","",""
"193268441476497410","Raggy#0001","10-Jan-18 01:25 PM","Its C++ instead of C","",""
"193268441476497410","Raggy#0001","10-Jan-18 01:26 PM","```c
condition ? expression if true : expression if false
```","",""
"193268441476497410","Raggy#0001","10-Jan-18 01:27 PM","basically C equivalent of python
```py
expression if condition else expression_if_false
```","",""
"234393687331700736","iTipTurtles#1777","11-Jan-18 11:07 PM","Having some issues with my CS50 IDE login. So its quite out of date, so I need to update it. But the update fails due to how old it is. 
Now if I go back to my account where I am going to make a brand new workspace, it asks for my email. However it then states my email is in use (already have a c9 account). But that account isnt linked to EDX/CS50. How can I fix this? I can easily create a CS50 workspace with that account if I login directly, but then it isnt linked to EDX.
So not sure how it will work with submissions","",""
"234393687331700736","iTipTurtles#1777","11-Jan-18 11:13 PM","Think I fixed it, just deleted one of the accounts I have","",""
"393854278764068875","curiouskiwi#1671","11-Jan-18 11:31 PM","@iTipTurtles in case any one else has this problem, there is no issue with using your existing c9 account for this course. Just be sure to create a workspace using the CS50 Template and it will all work fine with submissions, etc.","",""
"401156412308324352","Karlsen#2019","12-Jan-18 01:34 AM","Hello everyone!","",""
"401156412308324352","Karlsen#2019","12-Jan-18 01:34 AM","How do I run the custom library cs50 on IDE?","",""
"401156412308324352","Karlsen#2019","12-Jan-18 01:36 AM","","https://cdn.discordapp.com/attachments/395684800830373888/401157367703535617/image.png",""
"401156412308324352","Karlsen#2019","12-Jan-18 01:36 AM","I basicly always run to that error","",""
"393854278764068875","curiouskiwi#1671","12-Jan-18 01:44 AM","does `update50` work?","",""
"401156412308324352","Karlsen#2019","12-Jan-18 01:44 AM","It did","",""
"401156412308324352","Karlsen#2019","12-Jan-18 01:44 AM","But doesn't anymore","",""
"401156412308324352","Karlsen#2019","12-Jan-18 01:44 AM","In fact, cant run native commands anymore","",""
"393854278764068875","curiouskiwi#1671","12-Jan-18 01:45 AM","did you create a new workspace?","",""
"401156412308324352","Karlsen#2019","12-Jan-18 01:45 AM","Nope, still using the same","",""
"393854278764068875","curiouskiwi#1671","12-Jan-18 01:45 AM","at some point?","",""
"401156412308324352","Karlsen#2019","12-Jan-18 01:45 AM","It was working fine the last time I used","",""
"401156412308324352","Karlsen#2019","12-Jan-18 01:45 AM","Could it be because I switched computers?","",""
"393854278764068875","curiouskiwi#1671","12-Jan-18 01:46 AM","might you have created a new account when you signed in on the new computer?","",""
"401156412308324352","Karlsen#2019","12-Jan-18 01:46 AM","No, used the same. But I do have a second workspace that I originally created by mistake","",""
"401156412308324352","Karlsen#2019","12-Jan-18 01:46 AM","It was on Python template xD....","",""
"401156412308324352","Karlsen#2019","12-Jan-18 01:46 AM","Then I created this one for CS50, run update50 and everything went ok","",""
"393854278764068875","curiouskiwi#1671","12-Jan-18 01:47 AM","and are you sure that you aren't in that old workspace now?","",""
"401156412308324352","Karlsen#2019","12-Jan-18 01:47 AM","Well, one can never be sure","",""
"393854278764068875","curiouskiwi#1671","12-Jan-18 01:47 AM","what you are reporting is exactly what you'd see if you weren't using a CS50 workspace","",""
"401156412308324352","Karlsen#2019","12-Jan-18 01:47 AM","How do I check that?","",""
"393854278764068875","curiouskiwi#1671","12-Jan-18 01:48 AM","if you click the cloud 9 icon in top right, how many workspaces does it show?","",""
"401156412308324352","Karlsen#2019","12-Jan-18 01:49 AM","Yes, you are totally rigth","",""
"401156412308324352","Karlsen#2019","12-Jan-18 01:49 AM","My bad....","",""
"401156412308324352","Karlsen#2019","12-Jan-18 01:49 AM","Though, is there a way to change which workspace loads automaticly?","",""
"393854278764068875","curiouskiwi#1671","12-Jan-18 01:50 AM","it usually loads the last one you loaded on that computer","",""
"393854278764068875","curiouskiwi#1671","12-Jan-18 01:50 AM","so if you go to your cs50 one and close the other, it should start the cs50 one next time.","",""
"393854278764068875","curiouskiwi#1671","12-Jan-18 01:51 AM","or you can just delete the python one","",""
"401156412308324352","Karlsen#2019","12-Jan-18 01:51 AM","That's what I though would happen, but it actually loaded the other one","",""
"401156412308324352","Karlsen#2019","12-Jan-18 01:51 AM","Yes, better delete the Python one","",""
"401156412308324352","Karlsen#2019","12-Jan-18 01:51 AM","Thanks for the help","",""
"393854278764068875","curiouskiwi#1671","12-Jan-18 01:51 AM","ok","",""
"220190968354177025","kilolo#5578","12-Jan-18 10:04 AM","What i dont understand is why it is undeclared.","https://cdn.discordapp.com/attachments/395684800830373888/401285280474071041/Untitled_picture.png",""
"264694414645919745","Mrenda#1577","12-Jan-18 10:07 AM","I think it's because the hight variable needs to be before you use it in the `while()` part, i.e. outside the loop.","",""
"220190968354177025","kilolo#5578","12-Jan-18 10:08 AM","how do i use the (do, while) loop then","",""
"264694414645919745","Mrenda#1577","12-Jan-18 10:10 AM","You can evaluate something else to be true/not true in the `while()` test.","",""
"264694414645919745","Mrenda#1577","12-Jan-18 10:10 AM","Or you can initialise hight before you begin the loop.","",""
"220190968354177025","kilolo#5578","12-Jan-18 10:13 AM","ok thx","",""
"220190968354177025","kilolo#5578","12-Jan-18 10:13 AM","it works","",""
"152438978354741248","Kendall#1426","13-Jan-18 12:11 AM","@kilolo it's spelled 'height', not that computers care.","",""
"135553815830200322","huGa#4483","13-Jan-18 06:26 PM","~~Is there a way to default IDE's settings?~~ NVM, figured it out.","",""
"135553815830200322","huGa#4483","13-Jan-18 07:37 PM","@kilolo This is known as **variable scope**. Meaning that if you initilize your variable within your loop you won't have access to it from outside the loop. But if you initilize the variable before the loop you can access it from within the loop as well outside the loop.","",""
"220190968354177025","kilolo#5578","13-Jan-18 08:24 PM","my doubles wont use  the %(remainder operator)","",""
"220190968354177025","kilolo#5578","13-Jan-18 08:37 PM","intergers work,  but not my doubles","https://cdn.discordapp.com/attachments/395684800830373888/401806870899326976/double.png",""
"220190968354177025","kilolo#5578","13-Jan-18 08:45 PM","nevermind (long) works so ile just use it instead","",""
"393854278764068875","curiouskiwi#1671","13-Jan-18 09:55 PM","@kilolo  The modulo operator only works with integers.  Also, for future reference, this #ide channel is for questions specifically about using the IDE (template settings, workspaces, etc.) and not really for coding problems.","",""
"401121390465646597","Settings#3612","15-Jan-18 04:36 PM","","https://cdn.discordapp.com/attachments/395684800830373888/402471040627900416/unknown.png",""
"401121390465646597","Settings#3612","15-Jan-18 04:41 PM","i want an LOTR-themed ide, is that possible?","",""
"402505194119757824","BradW#8159","15-Jan-18 07:39 PM","Does anyone know if there is a Key Binding that lets me change focus between panes in the ide?  e.g., to go from the editor to the terminal and back with a key stroke instead of having to click in the pane with the mouse.  I've looked in the preferences settings and it appears that CTRL-' should do this, but it doesn't work for me.  Any ideas?  Thanks","",""
"193268441476497410","Raggy#0001","15-Jan-18 07:49 PM","@Settings you can add custom CSS to the ide since it's just a cloud9 instance","","👍 (1)"
"401121390465646597","Settings#3612","15-Jan-18 08:21 PM","@BradW alt S or ctrl S i believe","",""
"402505194119757824","BradW#8159","15-Jan-18 09:00 PM","@Yosamite Sam#3612 , alt-s - that's it, thanks!!","",""
"396469858553823232","arik kalmen#7170","15-Jan-18 09:30 PM","hi all i hope this is the right channel to post this question. I'm not seeing the PHP server on the IDE.","",""
"396469858553823232","arik kalmen#7170","15-Jan-18 09:30 PM","please advise if there is a better place to raise this issue","",""
"402537072587702275","yells at keyboard#9862","15-Jan-18 09:48 PM","what pset?","",""
"396469858553823232","arik kalmen#7170","15-Jan-18 09:50 PM","1","",""
"396469858553823232","arik kalmen#7170","15-Jan-18 09:50 PM","https://courses.edx.org/courses/course-v1:HarvardX+CS50+X/courseware/bdc606f10e7347f6a61a341c4544bbf7/71a3739357a54a0e81348468341214b3/?activate_block_id=block-v1%3AHarvardX%2BCS50%2BX%2Btype%40sequential%2Bblock%4071a3739357a54a0e81348468341214b3","",""
"396469858553823232","arik kalmen#7170","15-Jan-18 09:51 PM","at about 12 of the IDE short","",""
"396469858553823232","arik kalmen#7170","15-Jan-18 09:51 PM","minute 12 that is","",""
"402537072587702275","yells at keyboard#9862","15-Jan-18 10:47 PM","ur on week 1? lol","",""
"402537072587702275","yells at keyboard#9862","15-Jan-18 10:47 PM","u don't need that until week 6","",""
"396469858553823232","arik kalmen#7170","15-Jan-18 11:04 PM","yeah that was made clear in the video. will it magically show up in week 6 though?  i feel like some sort of instrucitons will need to be provided for it to be utilized","",""
"393854278764068875","curiouskiwi#1671","15-Jan-18 11:08 PM","@arik kalmen since that video was made, we have moved away from phpMyAdmin so it was removed from the IDE.","","👌 (1)"
"396469858553823232","arik kalmen#7170","15-Jan-18 11:23 PM","@curiouskiwi  thanks so much!!!","",""
"396469858553823232","arik kalmen#7170","16-Jan-18 02:28 AM","is there a forum  or wiki for common IDE problems? I feel like my problem is fairly common and I don't want to bother the channel","",""
"393854278764068875","curiouskiwi#1671","16-Jan-18 02:29 AM","@arik kalmen https://manual.cs50.net/ide/faqs","",""
"396469858553823232","arik kalmen#7170","16-Jan-18 02:29 AM","i just read through that. after saving and running ./mario new code isn't executing","",""
"396469858553823232","arik kalmen#7170","16-Jan-18 02:30 AM","not sure why","",""
"393854278764068875","curiouskiwi#1671","16-Jan-18 02:30 AM","(answered in #mario)","",""
"396469858553823232","arik kalmen#7170","16-Jan-18 02:31 AM","thank you @curiouskiwi  !!!","","😃 (1)"
"398945250745516043","mikeb#6016","16-Jan-18 04:30 AM","i t hink  that  when you create the nest loops  then your print f  statement prints the #########","",""
"194900754304073729","arlyd#9228","18-Jan-18 02:44 PM","Is there a way to disable these messages?","https://cdn.discordapp.com/attachments/395684800830373888/403530073774358528/unknown.png",""
"456226577798135808","Deleted User#0000","18-Jan-18 02:50 PM","No, I don't think so","",""
"194900754304073729","arlyd#9228","18-Jan-18 02:52 PM","Aw ok, thanks","",""
"456226577798135808","Deleted User#0000","18-Jan-18 02:53 PM","You do know how to save, right?","",""
"194900754304073729","arlyd#9228","18-Jan-18 02:57 PM","Lol yes mate thank you","",""
"194900754304073729","arlyd#9228","18-Jan-18 02:57 PM","A lot of the time I am looking at the man pages in the terminal","",""
"194900754304073729","arlyd#9228","18-Jan-18 02:57 PM","and everytime that banner comes down the windows jerk downwards to make space, I just find it distracting and annoying. I can appreciate why it would be good when you're starting off!","",""
"194900754304073729","arlyd#9228","18-Jan-18 02:58 PM","I have a compulsive habit to hit ctrl and s whenever I type more than a few words","",""
"456226577798135808","Deleted User#0000","18-Jan-18 02:58 PM","I didn't know how to save when i started Pset1 LOL 😆","",""
"456226577798135808","Deleted User#0000","18-Jan-18 02:58 PM","I had to go back and then see the part where he showed how to save","",""
"194900754304073729","arlyd#9228","18-Jan-18 02:59 PM","Ah I see 😄","",""
"207701977616875520","Hibiki#4566","19-Jan-18 06:27 AM","You can turn on autosave","",""
"403886236072149012","mirthek#9319","19-Jan-18 02:22 PM","Hello!
I keep getting an error (Pset1 / first week):

/tmp/naam1-96f278.o: In function `main':
naam1.c:(.text+0x19): undefined reference to `get_string'
clang: error: linker command failed with exit code 1 (use -v to see invocation)

For get_string as well as for get_int.
I checked my code multiple times, and it should work. How could I possibly repair this?","",""
"357166762564780033","brian#1055","19-Jan-18 04:25 PM","Hey @mirthek, did you remember to `#include <cs50.h>` at the top of your file?","",""
"396469858553823232","arik kalmen#7170","20-Jan-18 10:48 PM","has anyone else had success with using the collaborating tool? i added a contact, but i can't see the contact's messages and vice versa","",""
"348898174137532417","Kinno#3002","21-Jan-18 08:22 PM","its taking forever to update","",""
"348898174137532417","Kinno#3002","21-Jan-18 08:22 PM","x-x","",""
"348898174137532417","Kinno#3002","21-Jan-18 08:33 PM","is it normal for the `check50`","",""
"348898174137532417","Kinno#3002","21-Jan-18 08:33 PM","to ask for my github password?","",""
"194900754304073729","arlyd#9228","21-Jan-18 08:49 PM","It's been a while since I've used it but I'm fairly confident it's meant to yeah","",""
"348898174137532417","Kinno#3002","21-Jan-18 09:26 PM","how do i submit?","",""
"348898174137532417","Kinno#3002","21-Jan-18 09:26 PM","after performing check50 and style50?","",""
"348898174137532417","Kinno#3002","21-Jan-18 09:26 PM","oh nevermind","",""
"348898174137532417","Kinno#3002","21-Jan-18 09:27 PM","i was looking at the wrong place","",""
"194900754304073729","arlyd#9228","21-Jan-18 09:32 PM","Anyone else having issues with Cloud9 at the moment? It crashed out on me and now it'll load the interface but not my data. I think they may be having some problems.","",""
"348898174137532417","Kinno#3002","21-Jan-18 09:35 PM","its slow for me in general atm","",""
"348898174137532417","Kinno#3002","21-Jan-18 09:35 PM","but i just logged out so ¯\_(ツ)_/¯","",""
"194900754304073729","arlyd#9228","21-Jan-18 09:37 PM","😦 Aw ok. I was on a productivity streak","",""
"348898174137532417","Kinno#3002","21-Jan-18 09:37 PM","i know that feel :/","",""
"348898174137532417","Kinno#3002","21-Jan-18 09:37 PM","i would continue and finish pset 1","",""
"348898174137532417","Kinno#3002","21-Jan-18 09:37 PM","but gotta learn for history 😞","",""
"348898174137532417","Kinno#3002","21-Jan-18 09:38 PM","cya later then","",""
"194900754304073729","arlyd#9228","21-Jan-18 09:38 PM","Adios!","",""
"396469858553823232","arik kalmen#7170","23-Jan-18 11:30 PM","i posted a question to the stackover flow about using the IDE collaborator tool. Has anyone been able to make use of it?

https://cs50.stackexchange.com/questions/28139/how-to-collaborate-on-the-ide","",""
"393854278764068875","curiouskiwi#1671","24-Jan-18 12:04 AM","@arik kalmen it should work.  If you send me your c9 username, I'll invite you to my workspace and we can try it.","",""
"396469858553823232","arik kalmen#7170","24-Jan-18 12:04 AM","kk","",""
"396469858553823232","arik kalmen#7170","24-Jan-18 12:04 AM","thanks","",""
"393854278764068875","curiouskiwi#1671","24-Jan-18 12:30 AM","all sorted.  be sure to follow the link in the email from c9 after sharing. 😃","",""
"277494477248004106","aWoodDuck#9699","24-Jan-18 03:50 AM","Is anybody else having isues with check50 tonight? I can't seem to upload anything.","",""
"194900754304073729","arlyd#9228","25-Jan-18 12:50 AM","Am I right thinking that since Cloud9 was brought by Amazon, the only way to get a free service is via CS50?","",""
"359706126943649803","nl7#8266","26-Jan-18 11:40 PM","any cs50 grads try VScode? I'm really liking it","",""
"403211213699547157","Aternus#9711","27-Jan-18 10:07 PM","@curiouskiwi I've found a bug with the debug50 behavior.
How to replicate:
1. Set a breakpoint so that its not reached during execution
2. Run debug50
3. The Debugger window slides left, but since the breakpoint is never reached, it slides back right
4. Click the breakpoint again to disable it
5. Open the Debugger window, the breakpoint still present
* Clicking on the X below to clear all breakpoints does nothing","",""
"393854278764068875","curiouskiwi#1671","27-Jan-18 10:13 PM","@Aternus hmm. I can't replicate that.","",""
"403211213699547157","Aternus#9711","27-Jan-18 10:18 PM","Another thing I've noticed now... If you run debug50 with the Debugger window open it will close it after running. I would assume that it should keep the state at the moment of execution.
i.e. if you run it when your Debugger window is closed, then open it, at the end close it. If you run it with the Debugger window open, then do nothing.","",""
"403211213699547157","Aternus#9711","27-Jan-18 10:22 PM","@curiouskiwi You must click on the beakpoint (remove it) before opening the Debugger window again","",""
"403211213699547157","Aternus#9711","27-Jan-18 10:23 PM","Btw, now I've noticed that if you wait long enough, it will eventually disappear","",""
"393854278764068875","curiouskiwi#1671","27-Jan-18 10:26 PM","disappears instantly for me","",""
"393854278764068875","curiouskiwi#1671","27-Jan-18 10:27 PM","""You must click on the beakpoint (remove it) before opening the Debugger window again"" yes, I did that step.  the breakpoint is removed from the panel.","",""
"393854278764068875","curiouskiwi#1671","27-Jan-18 10:28 PM","maybe @kzidane  has seen this?","",""
"396469858553823232","arik kalmen#7170","29-Jan-18 11:56 PM","can someone help me with the debug50 tool","",""
"396469858553823232","arik kalmen#7170","29-Jan-18 11:57 PM","it seems you just need to type it then the c program name","",""
"396469858553823232","arik kalmen#7170","29-Jan-18 11:57 PM","but i'm getting this error","",""
"396469858553823232","arik kalmen#7170","29-Jan-18 11:57 PM","`~/workspace/pset2/vigenere/ $ debug50 ./vigenere
Looks like you've changed your code. Recompile and then re-run debug50!`","",""
"348898174137532417","Kinno#3002","30-Jan-18 12:01 AM","um","",""
"348898174137532417","Kinno#3002","30-Jan-18 12:01 AM","do `make` again","",""
"348898174137532417","Kinno#3002","30-Jan-18 12:01 AM","after saving, of course","",""
"348898174137532417","Kinno#3002","30-Jan-18 12:01 AM","if it still gives you that, proceed to rerun the code","",""
"348898174137532417","Kinno#3002","30-Jan-18 12:02 AM","The instructions programs give you are important","",""
"348898174137532417","Kinno#3002","30-Jan-18 12:02 AM","be sure to actually read them","",""
"393854278764068875","curiouskiwi#1671","30-Jan-18 12:03 AM","(answered in slack ... it wasn't compiling so you can't debug50 it.)  `help50 make vigenere` to get hints on that.","",""
"348898174137532417","Kinno#3002","30-Jan-18 12:04 AM","oh right, you cant compile sth with actual errors","",""
"348898174137532417","Kinno#3002","30-Jan-18 12:04 AM","but only to check the logic of a program that will actually run","",""
"396469858553823232","arik kalmen#7170","30-Jan-18 12:09 AM","yeah thanks @curiouskiwi","",""
"335843345853054978","Sufferah#9660","30-Jan-18 09:30 AM","Not sure why but all of a sudden the ""small.bmp"" from resize  when uploaded to the IDE only displays as 2x2 image. I have deleted and re- uploaded the original more than once.  The IDE seems to change the image showing only the upper left 2x2 pixels. All other images display correctly.","https://cdn.discordapp.com/attachments/395684800830373888/407799621302091796/problem.PNG",""
"335843345853054978","Sufferah#9660","30-Jan-18 09:54 AM","wierd hex seems fine just the displayed image is incorrect.","",""
"403211213699547157","Aternus#9711","30-Jan-18 10:56 AM","Cool, I didn't know the IDE can display images","",""
"194900754304073729","arlyd#9228","30-Jan-18 09:53 PM","@Sufferah how are you getting to it on your computer? Through Git?

Have you tried right clicking on the file in the IDE and downloading it?","",""
"194900754304073729","arlyd#9228","30-Jan-18 09:53 PM","It may be that you haven't push/pulled your git across","",""
"394586780810346496","Baris Can Ceylan#4867","30-Jan-18 11:56 PM","hey @curiouskiwi , is there a way to make IDE remember user settings? I keep setting the ""@showFoldWidgets"" to true yet it becomes false after a restart / login.","",""
"393854278764068875","curiouskiwi#1671","31-Jan-18 01:24 AM","@Baris Can Ceylan is that in the Preferences pane?  Perhaps @kzidane has insight?","",""
"394586780810346496","Baris Can Ceylan#4867","01-Feb-18 12:40 PM","@curiouskiwi @kzidane this reverts to false on restart, perhaps others too. Users settings are not keeped I believe.","https://cdn.discordapp.com/attachments/395684800830373888/408572254780260353/CS50_IDE.png",""
"393854278764068875","curiouskiwi#1671","01-Feb-18 09:48 PM","@Baris Can Ceylan I can't replicate the problem. My settings don't change when I restart the workspace.","",""
"348898174137532417","Kinno#3002","01-Feb-18 09:49 PM","perhaps its a setting somewherein the IDE","",""
"348898174137532417","Kinno#3002","01-Feb-18 09:50 PM","or perhaps the preferences might get stores locally in your cache and you keep deleting it?","",""
"394586780810346496","Baris Can Ceylan#4867","02-Feb-18 02:18 AM","@Kinno nope, a request is sent to api.cloud9 with modified settings, and received OK when anytime this change has made. Happens on firefox and chrome on Windows 7 and Linux.
@curiouskiwi other settings seems to do fine. to replicate it:
1 open user.settings, change line 21 value to true and save.
2 you should see that on hovering line numbers 1 and 2, little arrows are shown.
3 now reload the page. the value is still true, but arrows are gone. 
On this step:
- if you save the file (CTRL+S) and arrows come back.
- if you close the file and re-open it, value becomes false.","",""
"393854278764068875","curiouskiwi#1671","02-Feb-18 02:29 AM","oh yes, I see that now.  Does sound like a bug with cloud9","",""
"394586780810346496","Baris Can Ceylan#4867","02-Feb-18 02:40 AM","I've wrote a topic on Cloud9 Community, rest is up to them i guess.","",""
"393853722943553546","kzidane#6459","02-Feb-18 12:49 PM","@curiouskiwi  @Kinno no, we actually disable code-folding deliberately to simplify the UI. I'll see if we can add a setting to remember if the user changes it manually.","",""
"394586780810346496","Baris Can Ceylan#4867","02-Feb-18 02:33 PM","setting it false as default and letting the user keep their changes like the rest of settings would be better as the expected behaviour of this file is to keep settings as user wants.","","👍 (1)"
"397046488091328513","Crab#3915","04-Feb-18 01:48 AM","I followed the instructions from this to install the required libraries
https://cs50.stackexchange.com/a/7292","",""
"397046488091328513","Crab#3915","04-Feb-18 01:48 AM","But my code isn't compiling","",""
"397046488091328513","Crab#3915","04-Feb-18 01:48 AM","I'm using VS Code","",""
